,리치망고 애월본점,애월 곽지횟집,신의한모,근본 흑돼지,애월 고불락,애월 고깃간 본점,버거리 수제버거 제주 애월 본점,애월회포장센터 애월밤바다,하귀 흑생,크라운돼지 제주점,제주만주,광평도새기촌 본점,연돈가,마마롱,호커센터,애월 갈치포구,웃뜨리,너와의첫여행,제주애월리에,새물,제주나기,애월연어 본점,당당,이너프,인디언키친
0,강아지들 아직도 있네요 텅치큰친구들 ㅎㅎㅎ 오랜만에 들려서 한잔 전에뭘마셨었는지 기억이 안나서 스폐셜망고주문 진하니맛있어요 추억의리치망고 애월지나가면 들려요,사장님은 친절하셨으나…. 고등어 방어가 제철임에도 불구하고 엄청 푸석거리고 특히 고등어는 자투리 준 것처럼 두께도 제각각에.. 리뷰가 좋아서 간 곳인데 사실 많이 실망하였습니다 회가 신선하다는 느낌은 전혀 받지 못했어요,"사장님, 직원분 정말 친절하셔요! 무엇보다 두부요리 메뉴가 전부 다 맛있어요ㅠㅠ 손수 두부 만드시는 정성이 대박이고 그게 맛으로 전해져요!!! 두부 자체가 진짜 꼬숩고 건강해지는 맛이에요. 아게다시도후 기대하고 갔는데 선택한 메뉴 다 성공적이라 너무 뿌듯했습니당 바다뷰 보면서 식사하는데 힐링 그 자체였어요. 두유 아이스크림은 후식으로 딱이에요! 달달 시원한데 끝맛이 꼬소하고 두유맛이 나요. 두부 좋아하시는 분들 여기 필수 코스로 추천해요!!","삼겹살. 된장찌개. 멜밥. 냉면 세트랑 목살400g
추가해서 먹었음
냉면 완전 맛있어요!!
냉면 맛집임 ㅋㅋㅋㅋ
멜밥 처음 먹어봤는데~~ 이거 완전
집에 가서 생각날 맛이에요 ㅎㅎㅎㅎㅎ
꼭 세트로 주문해서 먹어보세요 
추천 꾸욱~~!!","제주도 1티어 맛집이에요!! 진짜로 고등어 조림 좋아하는데 여기가 제일 맛있었어요ㅜ 제주 2주차에 찾아낸 맛집..,애월의 최고맛집이 아니라 제주의 최고맛집 공기밥 3그릇 완전 가능!!!!!","제주도에서 흑돼지를 어디에서 먹을까 고민을 많이 했는데
현지분들이 많이 추천해 주셔서 이곳을 선택하였습니다 흑돼지는 역시 일반 돼지랑은 다르게 풍미가 훨씬 좋고 쫄깃쫄깃하고 더 맛있네요 
같이 나오는 고사리도 정말 맛있어요
잊지 못할 맛집이었네요
오픈한 지 오래 돼 보이지 않았는데 젊으신 분들이 열심히 일하시는 게 인상 깊었습니다","딱새우 버거가 궁금해서 방문했는데 진짜 제주도에서만 먹을 수 있는 버거 느낌이었어요. 완전 추천드립니다.
패티도 바로 바로 만들어서 구워주셔서 진짜 맛있었어요.
애월 온다면 꼭 재방문 할 거 같아요. 완전 추천드리는 곳!!!! 그리고 감튀도 맛있는 감튀였어요. 👍👍👍","회 먹고 싶을 때 집과 가까워서 자주 오는 곳이예요! 올때마다 신선한 회로 배 터지게 먹고 갑니다! 직원분들도 매우 친절하시고, 회도 신선+양많아 입니닷!! 특히 고등어회! 와우와우 진짜 꼭 드세요!!! 오늘도 잘 먹고 갑니다~ 또 또 또 재방문할꺼예요~","일단 직원분들 너무너무 친절하고 에너지가 좋았습니다 ❤ 바로 들어갈수잇음에 감사햇네요 ㅎㅎ 
여기도 맛집으로 많이 뜨던데 이유가잇엇어요ㅠㅠ
일상으로 돌아온 지금도 거기 멜젓이랑 고추젓갈이 지이ㅣㅣㅣㅣㄴ짜 생각날정도로 맛잇엇어요ㅠㅠㅠㅠ❤","고기가 1차로 훈연되어와서 금방 구워지고 구워주서서 편히 먹었어요.
쫄떼기살을 처음먹어봤는데 부드럽고 진짜맛있었어요.
고기를 좋은 걸 써서 그런가봐요. 내부 외부 인테리어도 넓고 주차도 편해서 너무 좋았습니다! 살짝 비싸지만 2명이 세트먹기에 딱 졸았어요!!!","애월에 위치한 만주집으로
1️⃣ 택배도 가능해 여행 선물용으로 참 좋습니다.
2️⃣ 제주 녹차와 땅콩을 활용한 만주로 특색이 있습니다.
3️⃣ 텍스쳐도 퍽퍽하지 않았고 버터향 고소하니 좋습니다.
4️⃣ 앙금 자체가 너무 달지않고 적당히 진해서 괜찮았습니다.",아이들이 갈비를 좋아해서 숙성흑양념갈비 시켰는데 정말 맛있네요! 특허받은 양념이시라고 하셔서 기대했는데 기대 이상이예요. 양념이 진하지 않아서 생고기 같아 보였는데 안에 양념이 다 쏙쏙 베어있더라구요. 생고기 좋아하는 아기도 입을 쩍쩍 벌리면서 더 달라고 하더라구요. 숯불에 구워 숯불향도 좋고 고기 뼈도 뜯어먹는 재미가 있어요 뼈가 엄청 잘 뜯기더라구요. 비싼 고기를 쓰시는 이유가 있더라구요. 자부심 있으실만해요. 애월쪽 오시면 여기 고기집 꼭 오셔야 해여! 강력추천이요,"연탄으로 초벌로 흑돼지 구워주니까 고기맛이 더 좋네요.육즙도 풍부하고 고기가 촉촉하니 맛있어요.
근고기로 식으로 고기가 나오니까 손실도 적고,
양도 많아서 3인분 시켜서 가족들이 넉넉히 먹고,
흑돼지 김치찌개도 가격도 너무 좋아서 밥까지 야무지게 다 먹었네요~
다음에 제주가면 다시 꼭 들리려 리뷰 남겨놓아요~","거꾸로 트리보러 평일오전에 갔는데 운좋게 바로 입장했어요~작년에 못봐서 아쉬웠는데 올해는 봐서 좋더라구요~
다만 하필 트리 뒷자석이라..
여러사람이 사진찍는데 프레임에 걸리는것 같아
편히 앉아있질 못했네요..
홍차 마셨는데 깔끔하고 맛있었어요^^",예약이 어렵다는데 저는 한번에 성공해서 기분좋게 갔다왔어요ㅋㅋ. 칠리크랩 소스가 진짜 환상적인 맛이고 갈릭라이스에 칠리크랩 소스와 시리얼 새우 가루를 올려먹으면 극락체험 가능합니다. 치킨사테랑 폭립도 겉껍질이 바삭하게 구워진게 소스랑 먹으니 정말 맛있더라구요. 성인남성 둘이서 갔는데 양이 너무 많아서 절반이상 남았네요. 포장도 가능하니 걱정마시고 마음껏 드셔보세요.,"2번째방문입니다^^
음식이 너무 정갈하게 고급지게 나와요.깔끔한 나무접시가 너무 예뻐요~~사장님의 친절도 이곳이 맛집임을 돋구워주네요~~골목길의 운치도 좋아요.그리고 음식이 무엇보다 신선해서 ♡♡♡♡","제가 좋아라 하는 빵들이 너무 많고 휴식 공간도 넘 다양해용
주차장에서 들어가면 2층인데 통창으로 바라보는 뷰는 
사람을 너무 편안하게 해줘용
제가 방문한 날은 설경이라 더욱 느낌이 있었어용
아래로 내려가면 1.5층이 나오는데 여기가 너무 아늑해서 여러명이 모여서 
뭔가 대화를 하거나 토론하기에도 좋겠더라구용
더 내려가면 영화관도 있고 앤틱한 의자와 테이블, 장식장이 있어서 분위기가 또 달라용
밤식빵에 밤이 넘 풍부하고 무엇보다 흑돼지 카츠 산도가 일품이었어용
돌하르방라떼가 맛이 정말 좋은게 아이디어도 좋더라구용
흠임자 맛도 나고 쿠앤크 맛도 나는데 우유를 부어서 먹으니 더 맛나용
생각대추차를 시켜 놓고 돌하르방라떼를 제가 다 먹었네용",가족들이랑 같이 가서 실내에는 사진만 찍고 같이 못 앉았어 실내는 아기자기하국요 야외에는 캠핑의자랑 테이블 있어 다 같이 둘러앉았어요 쿠키 맛나서 순삭했구요 귤체험은 못했지만 포토스팟이 있어서 사진찍고 놀기 좋은 곳이에요 그네도 타고 실외도 넓지는 않아서 금방 찍고 갈 수 있습니당,"애월에서 분위기 좋은 제주 파스타 찾는다면 애월리에로 오세용~ 로제떡볶이랑 애월리에 파스타 진짜 대존맛~~
특히 떡볶이맛 도랏서요~~ 매콤한 로제소스 맛에 해산물이 가득 들어있어서 엄청 고급스러운 떡볶이맛!!!! 파스타는 흑돼지 육수로 만들어 맛이 엄청 진하고 전복까지 들어가서 넘넘 맛있게 먹었어요~~ 완전 강츄~~~!!!","바다뷰가 정말 멋있습니다 
날씨 좋은날 애월 바다 보며 커피 마시면 정말 행복해질 것 같은 오션뷰 카페네요 
흑임자크로플도 맛있고 커피도 맛있네요 :)","11시에 예약하고 방문했어요! 딱새우전복장으로 했고 모찌리도후도 추가했는데 맛있게 잘 먹었습니다🩷
혼밥하기에도 넘 좋아요!! 귤도 챙겨주셔서 맛있게 먹었어요 ㅎ 주차는 가게 앞에 했는데 주차하기도 편했습니다 감사합니다~~","제주도 와서 연어같은 부드러운 회 한번 먹고 싶어서 애월연어 본점 다녀왔어요! 후기들 좋아서 기대했는데, 식당 내부도 넘 분위기있고 좋았어요. 평일 점심에 갔는데 사람 꽉차있는거 보면 역시 제주 연어 맛집인가봐요! 애월모듬초밥 시켰는데 연어가 너무 부드럽고 하나도 안느끼하고 좋았어요. 입에서 살살 녹고 다양한 맛을 한 판에 먹을 수 있어서 좋았어요. 연어 말고도 돈까스나 파스타 등 다양한 메뉴가 있어서, 혹시 연어 안좋아하는 일행이랑 와도 다같이 잘 먹을 수 있을 것 같아용~ 저도 동생이랑 맛있는 한끼 식사 잘 하고 갑니다~!","오랫동안 째려보던 수플레 팬케이크 먹으러 당당! 

인스타로 팔로우하다가 방문. 
아기자기하고 따뜻한 분위기가 좋아요. 

아침을 먹고가서 이번엔 수플레 팬케이크에 커피. 
가벼운 텍스쳐에 과하게 달지 않고 디저트로도 굿-!

주변 테이블 보니 파스타도 많이들 드심. 
다음 번엔 뇨끼와 식사류 먹으러 또 가볼 것 같음. 

접객도 친근하시고 좋아요. 
데이트 가족단위 친구끼리 다 좋음!",애월읍카페 이너프에 다녀왔어요. 우선 사진 찍기 너무 좋고 날씨가 쨍한날 가면 좋겠더라고요^^ 웨딩촬영도 하고 있었어요. 촬영하는 모습이 어찌나 예쁜지 힐링되는 시간이었어요. 아이들은 밖에서 즐겁게 뛰어놀고 비눗방울도 (직원분 허락받고) 날려보았습니다. 음료와 디저트도 너무 맛있게 잘 먹었어요💜 아이들이 너무 좋아해서 다음에 또 방문하려고요!!👍,"까시미르 케밥 너무 맛있아요ㅠㅠㅠ
기대 하나도 안했는데 까시미르케밥 최고였고 
커리도 진짜맛있었는데 양이 진짜 많아서 아까웠어요.
1인1메인메뉴라는 규칙이 양이 살짝 과한듯해요
저녁에 캄캄해서 예쁘진않겠지하고 방문했는데 밤에도 너무 예쁜 공간이었습니다:)"
1,"망고 진짜 좋아해서 꼭 와보고 싶었던 곳이에요 
둘다 맛있는데 저는 그냥 프리미엄 애플 쉐이크!? 기본 망고가 더더더 맛있었슴다 그리고 매장 앞에 바다 있어서 뷰가 너어어어무 좋아요 바다뷰🥭🌊","회도 정말 맛있었지만 해물탕이랑 라면은 진짜 잊지못할맛이였어여,,양도 많이주시고 맛있어서 기분좋은 여행 마무리였네요^^",제주도 오면 또 맛보고 싶은 집이에요^^ 두부가 넘 고소하고 맛나요. 건강해지는 느낌 듬뿍^^ 배불리 먹었어요. 폭설 내릴때 들렀던터라 대기없이 들어갔네요 ㅎㅎ,"삼겹,목살은 초벌해서 나오는데 너무너무 맛있었고 생갈매기살도 진짜 너무 맛났어요. 언니에 부연설명도 굿굿
3인이 삼겹먹고 하나또 추가하고 생갈매기먹고 또추가하고 배가 터지도록 맛나게 먹었어요~
된찌는 진짜 게큰거하나 들어있고 슴슴하니 계속 숟가락을 부르는듯했어요~^^ 우리가족 입에 최고였어요♡
담에 또 제주도오면 또올 맛집입니다^^♡
날이 너무 안좋아서 택시도 안잡혔는데 도와주셔서 잘도착했어요~너무 감사합니다.","게스트하우스 스탭 추천으로 왔어요 ! 
뭐먹고싶냐고 메뉴 읊어주길래 제육이라는 단어에 꽂혀서 왔는데 친구랑 말도 거의 안하고 흡입했숩니다 … 겨울에 상추가 이렇게 신선할수있나 ,, 싶고 상추밥 ..? 처음듣는데 제육이랑 상추밥이랑 소스랑 이게 뭔지합인지 싶지만 일단 먹어들 보세여 .. 다음에 가족들 데려오면 가족세트 꼬오오오옥 먹어보고싶어요 잘먹었습니다 ‼️‼️‼️‼️‼️",사장님도 친절하시고 고기도 맛있었습니다. 제주물가비싼데 여긴 좋습니다. 눈탱이안맞았어요ㅎㅎ 화장실에 가글과 핸드크림같은 섬세삼도 돋보였습니다. 애월오면 또 오고싶은고깃집 추가요,"해변 바로 앞 뷰 맛집.
주문하고 조리 시작이라 조금 기다리기는 했지만
기다린 보람 있었어요ㅎ
아기자기 예쁜 인테리어 구경하면서 사진찍기도 좋았고,
요즘 수제 버거 맛집 많다 하지만
제 기준 top3 안에 꼽히는 곳이에요ㅎ
잘 먹었습니다~~","회 좋아하는 딸때문에 급 찾아온집!!
애월밤바다~~
한마디로 정말 제주스럽고 넘 멋져요~~^^
분위기도 짱이지만 음식맛도 좋아요.회 싱싱한건 당연하고요.방어가 다 떨어져서 못먹어 좀 아쉽지만 가성비도 좋고 정말 추천드리고 싶은 곳입니다^^","먹는거에집중해서고기사진을이쁘게(?)
못찍었지만ㅋㅋㅋ초벌되어나오는흑돼지ㅠㅠ
진짜너무맛있었어요!!!!
육즙이팡팡ㅠㅠ애월에맛있는흑돼지맛집을
찾은것같아서너무좋았구요!!!
사이드메뉴들까지완벽ㅠㅠ찌개에도시락쫄면
다맛있었어요❤️","첫번째 사진 A세트. 세번째 사진 B세트임ㅡ
간김에 두 세트 다 먹어봄ㅎ 다 맛있음🤩
노형 집 부근에 한집건너가 고기집들이라ㅡ 멀리 찾아가서 먹지는 않는데~ 
유명한 셰프님이 운영하시는 곳이라 궁금해서ㅡ 평화로 지나가다 들림~ 
근데ㅡ 와.. 고기 진짜 부드러움. 초벌해서 작은 통?에 담아오는데ㅡ 돈마호크.목살 전부 다 맛있어서 좋았음.
반찬도 정갈하고 귤김치는 새로웠음. 사이드 메뉴(비빔냉면. 짜글된장은 우리입맛에 별로였지만ㅠ)
근데 송훈셰프님이 직접 구워줘서ㅡ 진짜 더더 맛있었던거 같음ㅋㅋ 잘생기심~~ㅎ
배우 권오중님 닮으심😅 아드님때문에 해외 왔다갔다 하느랴 바쁘시다던데~ 건강 잘 챙기시고 가게도 더 번창하길 바랍니다~~!!
정말 맛있게 잘 먹고갑니다.
주차편하고 다들 친절하심!!","만주는 뻑 뻑해서 좋아하지 않는데
이무슨일! 너무 맛있습니다 촉촉과 뻑뻑의 중간이네요 과하지않은 단맛이 너무 맛있어요
가격이 좀 있지만 선물용으로, 한번씩 먹기로 좋은거 같아요 4개사서 먹고 선물용 9개짜리 4개 구입했어요","✅️ 애월흑돼지 찾고 있다면, 광평도새기촌 추천드려요:)

먼저 고기 두께가 엄청납니다! 역대급 사이즈의 고기를 맛볼 수 있어요:)

그런데 대표님께서 직접 고기를 구워주셔서 육즙이 날아가지 않아서, 부드럽고 쫄깃합니다!

그리고 김치 라면 국수는 사이드로 최고입니다! 라면과 국수에 뜨끈한 국물까지~~ 너무 맛있었어요:)

마지막으로 밑반찬으로 나오는 간장게장이 죽여줍니다! 마음 같아서는 10번씩 리필하고 싶은 맛있습니다. 싸구려 게가 아니라, 진짜 토실한 게가 나옵니다!

애월에서 흑돼지집을 찾고 있다면, 광평도새기촌 강추합니다!","제주 근고가 흑돼지 연탄으러 구운거 먹고 싶어서 찾았능데 리얼하게 연탄에 구워주는거 볼수 있고
육즙 가득하게 구워주니 촉촉한 맛과 함께 불향도 맡으면서 진짜 맛있게 먹었네요~
가족들도 만쪽해서 앞으로 연탄구이 흑돼지는 연돈가에서만 먹은걸로 찜",일상적으로 디저트를 찾는 편이 아닌데 달지 않고 고급진 맛에 먹는 동안 감탄 연발.. 정말 이곳이 프랑스인가 했답니다. 남은 여행 내내 마마롱의 디저트가 두고두고 생각났어요. 마침 방문한 다음날부터 한달간 임시휴무라고 해서 정말 행운이었지요. 다음 제주갈 때 매일 갈거예요 ㅠㅠ,"예약하기 진짜 어렵습니다ㅠㅠ 천운으로! 2024년 운은 이걸로 다 쓴거같아요ㅎㅎ 누가 취소했는지
우연히 한번 더 그 타이밍에 조회를 해서!!! 진짜!!! 타이밍 좋았구요 너무 맛잇엇어요!! 종류별로 다 먹고싶어요!! 언제 또 갈 수 있을지 모르겠지만 가게된다면 여한이 없겠습니다…♥️ 진짜 맛잇고요 진짜 맛잇습니다 ㅠㅠ 사장님 완전 친절하시구요 게 다 발라주시고 암튼 잘 되는데는 이유가 있어요 진심 나만 알고 싶은 집입니다.. 또 가고 싶어요 제주도 갈때마다 가고싶습니다 ㅠㅠ 너무 맛잇어요!! 사장님 사랑합니다",순살갈치조림 너무 맛있었어요. 양념도 맛있고 양도 많아요.갈치가 부드러워서 정말 맛있더라고요.갈치구이도 맛있고 물회랑 전복구이도 맛있고 후식으로 감귤주스도 주셨어요. 제주도에서 먹은것 중 젤 맛있었어요. 너무친절하시고 음식도 맛있고 깔끔해서 남편이랑 다시 오고싶은 맛집이네요.,"애월에 위치한 웃뜨리 큰 규모에 깜짝 놀랐어요
근데 빵은 훨씬 더 크네용 ㅋㅋㅋ
와 다들 빵 크기가 엄청나요
빵 너무 맛있네요 ㅠ 순삭 했어요 
빵 나오는 시간에 맞춰 나오면 따끈한 빵을 먹을수 있어요 돌하르방라떼는 달달하니 모양도 너무 재밌어요
맛도 최고에요 할미넴 입맛들 오세요 ㅋㅋ
오두막도 사진찍기 예뻐요👍🏻","카페 인테리어가 아기자기하게 예쁘고 커피와 디저트 메뉴들도 다 예쁘고 맛있었어요.
감귤크로플은 감귤잼이 같이 나왔는데 잼이 맛있었어요.
카페에 포토스팟도 많아서 아이와 사진 많이 찍을 수 있어 좋았습니다.
그리고 음료를 시키면 귤따기 체험도 할 수 있는 점도 좋았어요. 1인당 5개씩 딸 수 있어요.","여긴 무조건가세요. 제주도 애월오자마자 방문했어요. 
나만 알고싶은 애월브런치맛집이네요.이런곳이 있었다니~ 
분위기도 좋고 음식도 진짜맛있어요.당근수프는 👍파스타도 재료아낌없이 팍팍 넣어주셨고 ~ 정말 맛을 잊지못하겠어요. 진짜 나만알고싶은 곳이네요.제주도 오면 또 올곳 재방문의사 100%에요.","차타고 가다가 발견한 조용한 오션뷰 카페
오션뷰는 대형 베이커리 카페라 사람도 많고 소란스러운 편인데 여기는 예쁜 오션뷰를 가지고 있는 카페지만 조용하고 분위기 있어서 좋았어요❤️
1-2층 실내, 3층 루프탑이고 날 좋은 봄날엔 루프탑에서 커피 한 잔 하고 싶네요!
새물라떼 추천🫶🏻
흑임자 좋아하는 할모니 입맛 제대로 저격한 커피
흑임자오메기떡크로플 추천🫶🏻
엄마는 달다고 했지만 제 입맛엔 최고였어요❤️
떡의 쫀득한 느낌과 흑임자 크림, 가루가 가득~아이스크림까지 너무 잘 어울렸네요. 떡이 되게 얇게 눌려있어서 첨엔 당황했는데 오히려 좋았어요...🥰
떡을 좋아하지 않는데 저렇게 얇게 눌려있으니 떡같이 느껴지지 않아서 좋았...🙊🙊","감기로 고생하는 중에 맞이한 결혼기념일~~
몸보신 하며 편한 식사를 찾다보니 바로 제주나기로!
언제 가도 멋지고, 맛있고 또 사장님의 친절함이 우리부부를 행복하게 한다.
감기 걸린 나를 걱정해주시는 사장님 진심이 느껴져서 더더욱 감사히 잘 먹었네요^^
다음엔 건강하게 갈께요.
그때도 맛있게 부탁드려요~~♡
사장님도 감기 조심하세요^^",제주애월맛집❣️애월연어💝딸과함께하는데이트추천🎀생연어사시미먹고왔어요🎊둘다연어킬러 ㅋㅋ살살녹는연어와상큼한레몬🎉신선하고담백담백해요🎈또오고싶은곳🖼️친절하신직원분 최고🌻,"대표메뉴인 브런치수플레, 토마토라구뇨끼, 감자수프와 브리오슈를 시켰습니다. 수플레는 부드럽고 퐁신하면서 맛있었습니다. 저는 개인적으로 감자수프가 가장 입에 맞았어요. 감자수프에서 치즈의 맛이 약간 느껴져 조화로우면서 부드러운 맛이 났습니다.","하트시그널에 나왔던게 인상 깊어서 방문했어요 빨간지붕 건물은 이제 사진관으로 바뀌었지만 야외 잔디밭은 얼마든지 이용할 수 있음!! 말차라떼, 호지차라떼도 맛있었고 빨간지붕 건물 하나만으로 이너프 카페 방문해볼 이유가 충분함 비행기 지나가는 것도 보이고 사진 찍고 놀기 좋아요",인도카레계의 GOAT✨️ 오늘도 설거지했습니당🤤 엄마가 이렇게 음식을 좋아하시는걸 처음봐요.. 매주마다 주말만 되면 가자구 먼저 설레어하셔요ㅋㅋㅋ 진짜 찐맛집또또또또또간집👍 가까운데 살아서 행복해요....🥰
