71,"제주 망고 집에서 맛 베스트 ~👍
애월 오면 꼭 들리는 곳이에요 ~~~",재료가 신선해서 다 맛있었어요! 특히 딱새우회가 달달하니 넘 맛있었습니다,부모님 강력추천으로 여자친구와 간 두부요리 전문점이에요. 아게다시도후는 두부를 튀겨서 가쓰오부시 소스에 담궈먹는 요리인데 일식을 좋아하시는분 이라면 눈돌아가서 드실수 있는 맛입니다. 마파두부고 마냥 매운게 아니라 후추랑 특유의 향이 정말 맛있게 매콤한 맛입니다. 직원분들이 그릇도 빠르게 정리해주시고 음식도 빨리빨리나와서 정말 좋았습니다. 다음에 가면 세트요리로 꼭 먹어봐야겠어요. 가격이 결코 싸다고는 생각안들었지만 가심비는 정말 최강!!! 왜 이효리님 추천맛집인지 알겠네요 다음에는 저녁에가서 배터지게 먹어야겠네요🐷🐽,"삼겹세트에서 홍게된찌와 비빔회냉면 선택하시는거 추천합니다!! 너무 양도 좋은데 맛이 진짜 일품이에요,,,🫶🥹",너무 맛있어요~~!!!!! 상추밥 최고,시그니처 흑돼지 오겹 먹었어요 진짜 세상 두툼해서 육즙도 많고 껍데기가 붙어있어서 쫄깃해요 단연 제주도 1등 흑돼지 맛집이네요,둘 다 맛있어요!! 전 딱새우가 더 맛있🍔,회가 전체적으로 맛있고 파전이랑 들깨 지리탕도 엄청 맛있어요,숯불향나고 맛있어요~!,세심하게 설명해주는 서비스도 좋고 무엇보다 너무 맛있게 먹었습니다~~^^,궁금한데 제주 놀러온김에 사러 왔어용!! 기대 중입니당,"제주도에서 먹은 곳들 중에서 제일 기억에 남는 집이에요,,, 밥에 비벼먹는 멜젓 잊지못해,,,, 💗😝",굿,분위기 좋아요. 마마롱 케잌 커피와같이 먹으니 맛있네요. 시트가 아주 촉촉하진 않있지만 많이 달지.않아서 맛있어요.,"6번째 방문.
오래간만에 방문해서 테이블 바뀐것도 이제 알았네요^^
여전히 음식은 맛있게 잘 먹었습니다.","여기가 찐이에요...진짜 여기 와야해요 여러분
제가 SNS도 안하고 완전 아날로그의 삶을 사는데
리뷰를 적게 만드는거 자체가 말다함...
가성비 일단 장난아니구요, 음식이 다 맛있음!
진짜 거짓말 안하고 양념장부터 다 맛있음
제일 좋은거는 사장님들이 너무 친절하시고 열심히 하셔가지고 그게 맛으로 나타나는것같아요
먹다가 너무 맛있어서 볶음밥까지 직접 만들어 먹음요... 다음에 오시는 분들 갈치조림 먹으면 무!조!건! 볶음밥 맨들어 드세요 제발......
암튼 생긴지 얼마 안된 식당이라 손님이 많이 안오는거 같은데 나만 알고 있으면 좋겠다가도 번창했으면 좋겠다는 마음...🫶 
같이 부자되요 사장님....돈 많이 벌어서 또 올게요!","가족여행으로 들렸는데 매장이 깔끔하고 커피, 빵 모두 맛있었습니다!",야외와 실내 모두 너무 예쁜 카페입니다. 가족들과 함께여서 더욱 좋았어요.,"호텔서 걸어서 20분정도 걸리는데,
풍경보고 걷고있으면 금방가네요^^
분위기도 좋고 음식 맛날듯!!",뷰도 이쁘고 망고빙수 맛나고 커피맛도 신선합니다,제주에서 히츠마부시를 먹을 수 있어서 너무 좋았어요! 맛있게 잘 먹었습니다 :),"— 집 근처라 재방문에 재방문을 했어요! 친정 엄마도 남편도 애도 매우 좋아하는 애월연어! 
— 애월 유수암이 본점이고 서귀포와 하귀에도 분점을 오픈하셨더라구요~ 역시 맛집! 예약 안 하고 가시면 자리가 없을 수도 있으니 예약 하고 가시는 걸 추천드려요. 
— 저희가 제일 좋아하는 메뉴는 “연어한판(52,000원)” 입니당:) 연어 머리부터 뱃살, 꼬리까지 각각 어울리는 다른 방식으로 요리되어 나오구요, 매우 신선하고 풍미가 있어요~ 
— 키오스크로 주문하고 음식이 나오기까지 시간이 좀 걸립니다, 배고프시면 미리 방문/ 예약 하셔용! 
— 모든 메뉴가 비쥬얼 갑이니까 사진 찍을 준비 잘 하시고 가시구요~!",인테리어가 너무 예쁘고 음식플레이팅도 너무 훌륭해요 맛과 멋 둘다 있어서 다음에 또 오고싶네요!! 굿굿,"뷰가 너무 예뻐요~ 
커피도 무난하니 괜찮고
디저트도 맛있었어요!!
별관이 따로 있어서 너무 좋더라구요 ㅎ",맛있었습니다
72,"제주에 오면 항상 찾는곳이에요
맛있어요",너무 친절하고 회도 정말 맛있었어요~!! 완전 추천합니다 ><,"유지니가 추천해준 맛집 

이젠 유진이 없는데 추억하러 와봄 

두부는 늘 맛났음",버스타고 지나가다가 근본이라는 간판이 딱 눈에 들어와서 들어와서 먹게 됐는데 진짜 탁월한 선택이었던 거 같아요ㅠㅠㅠㅠ고기 질도 좋고 양도 많아서 네 명이서 푸파했는데도 엄청 배불러요 직원분들도 친절하시고 고기도 맛있게 잘 구워주셔서 좋았어요 감사합니다 나중에 또 방문할게요💕💕,"우연히 이호테우해변 근처 식당을 찾아보다가 바로 근처는 아니지만 메뉴에 꽂혀 방문했어요.
고등어조림에 쌈밥을 싸먹는데 저기 흑임자소스??를 찍어서 같이 먹으라고 하시더라구요. 
고등어조림에 웬 흑임자소스지?하고 반신반의하며 찍어 먹었는데 정말 말도 안되게 신세계였어요ㅎㅎ
강된장도 맛있었지만 흑임자에만 찍어 먹었네요ㅎㅎ",고기양도 꽤 나오고 두께가 있어서 육즙이 풍부하니 고소함이 가득해요 가게가 쾌적하니 너무 좋네요,"수영하러 곽지 갔다가 먹은 수제버거 
꽉 눌러도 도톰하고 육즙 미쳤다
햄버거 생각날 때마다 가는 버거리지만 
오늘은 더 맛있네 👍",가족모임으로 왔는데 분위기도 너무 좋았구 무엇보다 재료들이 너무 신선해서 좋았습니다! 다음에 또 올게용ㅎㅎ,"오랜만에 흑돼지 영접했는데
두툼한 오겹살❤️ 맛과 식감 제대로 즐기고 갑니다
완전 흑돼지매력에 빠져버림…",당니귀 프로그램보구 괴짜 쉐프님인줄 알았는데 전말정말 맛있네용ㅋㅋㅋ 직원분께서 고기도 부위별로 먹는법 설명해주시고 잘먹고갑니디:),유명하다그래서 방문해봤는데 너무 맛있어요 모양도 예쁘고 구성도 좋아서 선물용으로 더 많이 사가려구요 !! 🩷🩷🩷,너무맛있고 친절해요,맛있게 잘 먹었습니다~,NAN,너무 맛있게먹어서 또 가보려고 예약노리는중이에요,"순살갈치조림세트 2인

갈치조림 너무 맛있고, 간이 세지도 않아서 부모님 모시고 오면 좋을 것 같아요~

순살이라 먹기 편하고 사장님도 친절하세요.☺️",특별한 음료와 베이커리 종류가 많았는데 뷰도 너무 좋고 감귤체험까지 가능한 곳이라 아이랑 오기 너무 좋았어요 ~ 카페가 예뻐서 지나가다 들렀는데 관광버스로 단체 손님이 올정도로 정말 인기집인듯 싶더라구요 ㅋㅋ 빵도 맛있어서 4개 넘게 먹엇어요 ㅋㅋ 다음에 또 오고 싶은 베이터리 맛집으로 완전 추천이용,"제주 올때마다 들리는 곳입니다. 벌써 4번째 방문이예요. 귤은 아직 안 익어서 체험은 할 수 없지만 멀리서 왔다고 배려해주셔서 아이들 3개씩 따보라고 하셨어요. ㄱㅏ장 심혈을 기울여서 따고 온 날이 아닐까합니다. 사진은 여전히 예쁘게 찍히고 메밀밭도 너무 이뻤어요.
사장님 항상 친절하게 맞이해주셔서 제주에서의 여행을 즐겁게 시작합니다. ^^ 청귤도 넘 맛있어요 ❤️",흑돼지 돈까스!!! 해산물 크림 파스타 진짜 맛있어요!! 돈까스의 부드럽고 바삭한 식감이 너무 맛있었던 흑돼지 돈까스 잊지 못할거 같네여,"애월해안도로에 위치 + 주차장 편리해서 넘 좋았어요
뷰 맛집이라 포토존에서도 사진 잘 나오더라구요
채광이 좋아서 카페 안에서 사진 찍어도 잘 나와요
음료도 맛있고! 애월 카페로 추천입니다아 👍","진짜JMT... 제주도 사는 언니가 추천해줘서 여행 마지막날 갔는데,,진짜 미쳤어요ㅠㅠ다 맛있구요 정갈하구요..또 갈거에요ㅠㅠ!!","제주 퓨전 레스토랑 연어 요리 전문점 애월 연어입니다. 산자락에 위치한 생선 요리 전문점이라는 독특한 컨셉의 레스토링 답게 상상력이 가득한 퓨전 연어요리를 제공합니다. 연어 평소에 즐기지 않는 분들도 맛있게 먹을 수 있는 연어 맛집이에요. 화이트 크림 파스타 (15,500원), 스노우 초밥 (18,900원), 연어 유부 초밥 (13,900원), 애월 연어 한판 (52,000원)이 있는데, 이탈리안 스타일을 좋아하시는 분은 애월 연어 한판을 재패니즈 다이닝을 좋아하시는 분은 스노우 초밥과 연어 유부 초밥 추천합니다. 제주도 가신 분은 꼭 한번 들러보세요. 제주 연어 요리 전문점 애월 연어 본점 추천합니다.",맛있어요 ! 제주도 오면 또오려구요,NAN,커리가 조금 상큼한? 맛이 강해서 제 입맛에는 그저 그랬어요 오히려 새우초우민이 의외로 입맛에 맛았던! 매장이 예쁘고 대화나누기 좋았어요
73,진하니 맛있어요,강아지랑 함께한 여행이였는데 반려견 동반 가능하여 좋았습니다 ^^ 바닷가 근처였어요,특색있는 두부 메뉴들 맛있네요~ 배부른 제주도 여행객들 단품도 맛있을것 같아요!,"흑돼지 고깃집 많은 곳 방문했지만 여기 '근본'은 단골될것 같아요! 근고기 스타일의 고기맛 완전 대박👍 , 아이 둘과 함께 방문했는데 1도 불편함 없이 너무 친절하고 편안하게 해주셨어요^^ 리뷰 잘 안쓰는데 강추합니다.","고불락에 들어서면 귀여운 댕댕이가 먼저 마중을 나온다. 식당에 들어서면 자기가 갈 곳이 아니란 듯 휙 돌아서 제집으로 들어간다.
가게는 조그맣게 감성이 넘치는 모습에 이미 맛있겠거니 생각이 드는 모습ㅎㅎ
내부는 생각했듯이 테이블 1개에 좌식 2개로 소소하게 운영이 되고있다.
본인은 혼자 왔는데 1인메뉴는 3가지가 있다.
올때부터 마음 먹었던 상추밥을 고르고 얼마 지나지 않아 음식이 나왔는데 너무 푸짐했다..
미역국과 제육, 각종 반찬들은 짜지않고 삼삼하게 맛있었다. 특히 쌈을 싸서 먹을 때 각종 재료와 소스의 조합은 그야말로 환상..!
열심히 쌈을 싸서 먹었지만 고기와 반찬이 많이 남았다.. 배가 터질 것 같았지만 고민 끝에 공기밥을 추가해서 먹었는데 밥은 남기고 말았다...
재방문 필수인 인생맛집 등극!!",상추에 콩나물 흑돼지 오겹살 취나물 고사리 나물 올려서 쌈싸먹으면 맛있어요 반찬이 맛있는데 셀프바가 잘되어있어서 좋아요,"such a good hamburger!!
id love it",딱새우 포장해서 숙소에서 먹었는데 크고 싱싱하고 너무 맛있게 잘 먹었습니다,"와우…파무침+백김치+고기 맛 도름
와우…버섯에 쌈장 기름장 마늘 ㄱ ㄱ","고기는 진~~짜 맛잇어요! 직접 구워도 주시고! 의외의 별미반찬이 귤된장무침이엇네요~~ 돈마호크 첫점을 너무 맛있게 먹어서 1인분 추가! ㅎㅎ 밑반찬이 많은편은 아니고 반찬이 빌 때마다 알아서 채워다주시는데, 느끼함을 잡아줄 반찬이 부족한 듯 햇어요~ 볶음밥이 갈치속젓 베이스엿는데 시원한 동치미국물이라든지 그런게 같이 나오면 좋을 듯 하더라구요~ 여튼 웨이팅이 잇어도 생각보다 다들 빨리 드시고 가서 금방 앉앗음!! 술(6000원) 채소만 든 된장밥(6000원) 등 제주물가 체감햇네용ㅎㅎ","만주좋아해서 제주여행온김에 들렀습니다.
친절하시고 웨이팅없어서 좋아요!!",맛있어요!! 저는 개인적으로 생갈비도 맛있었지만 양념이 더 제 입맛이었어용~ 김치찌개도 달지 않아서 너무 맛있었습니당,굿,구우우웃,"칠리 크랩만 먹다가 블랙페퍼 크랩 시켰고, 정말 맛있게 먹었습니다. 칠리는 한번 먹고 나면 한동안 생각 안나는데, 블랙페퍼는 집에 왔는데 다시 또 먹고싶네요!","순살갈치조림& 갈치구이 세트 시켰어요~
말육회도 부드럽고 소스가 맛있어요~
물회도 👍👍 전복도 많이나와서
아들이 맛나게 잘먹네요
무엇보다 갈치조림, 갈치구이 가 진짜 대박맛나요!!
다 손질해주셔서 너무 편하게 잘먹었어요
😍😍 잘먹었습니다😉","애월에서 한라산 가는길에 들어간 베이커리카페입니다.
브런치겸시킨 시킨 흑돼지카츠산도 맛있었어요.
매장이 깔끔하고 넓어서 편하게 이야기하기 좋아요^^
치즈누룽지도 괜찮았고 잠봉바게트 추천!","귤밭체험도 가능하고 메밀밭도
포토존으로 넓고 예뻐요
누네띠네파이 크기도크고 바삭하게
맛있어요","인테리어도 너무 이쁘고 다시 또 오고싶은 곳이예요^^ 사장님도 친절하시고 돈까스가 특히 맛있는데 다 먹어서 사진을 못 찍었네요ㅜㅜ🥺
또 올게요💜","애월해안도로에 있는 카페 새물
바로앞에 바다가있어서 뷰가좋아요

시그니처 오메기크로플
겉바속쫀 식감에 아이스크림 🍦 

애플망고주스랑 새물에이드도
달달하고 진해서 맛있어요

자리마다 콘센트도 많아서 유용하고
2층엔 포토존자리도 마련되있어 👍 👍 

날이 흐려도 예쁜곳이네요
쨍쨍할때 재방문해보고싶네요 :)","인테리어가 예쁘고, 무엇보다 너무 친절하세요.
그리고 맛도 짜지않고 담백하게 맛있습니다","애월맛집 뷰도 너무 예쁘고 맛도 좋은 애월연어에 다녀왔는데요, 엄청 친절하시고 저희가 주문한 뚱땡이초밥, 사케동, 매콤우동 모두 너무 맛있었어요! 통창으로 보이는 자연과 햇살이 너무 좋아 보기만 해도 기분 좋구요, 거기에 맛있는 음식까지 함께 하니 더욱 더 좋았답니다 👍🏼 다음에 방문하면 애월연어 한판 시켜 먹어봐야겠어요 :)",제가 세상에서 먹은 뇨끼중에 남바원이에요!! 너무맛있어용! 수플레도 진짜쵝오!! 배부른데 멈출수없는맛! 계속 생각날꺼같아요ㅠ 제주도민 부럽습니당,"바밤바라떼는 쏘쏘고
토마토 바질에이드는 맛있엇어용","와, 진짜 바깥 정원도 예쁘게 잘 가꿔놓으셨는데, 내부도 식물원 같은 느낌이 많이 나서 너무 예뻤어요! 커리는 생각보다 양이 많았고 맛은 무난무난 했던 것 같아요! 직원분들도 친절하시더라구요! 바깥 정원에 많은 꽃이 있어서 엄마께서 너무 좋아하셨어요☺️☺️"
74,여전히 맛있어용,"대게 살이
꽉 차있구 엄청 맛있었어요
게딱지밥은 무조건 먹어줘야하는거💗💗
넘 맛있었어요",가격 대비 비싸다는 느낌. 가격만 좀 낮추면 좀 특이한 두부요리 먹었다는 느낌이 들 가게.,"훈제로 한 번 구운 뒤에 나오고 찍어먹는 종류가 많아서 좋았어요. 특히 명란젓이 맛있더라고요. 소금도 누룽지랑 섞은건지 고소하고 많이 안짜서 좋았습니다!
관광지라 약간 가격대가 있긴하지만 모든 메뉴가 다 맛있었어요 꼭 세트메뉴로 시켜 드세요👍","제주 마지막 메뉴였는데 아주 맛있었어요 
식당 내부도 제주 옛갬성이 나고 고등어조림도 밥도 맛있었습니당 👍🏻👍🏻",초벌해서 나오는 흑돼지 오겹이라 먹음직스러워요 육즙이 넘쳐 흘러요~ 취나물 고사리가 이 고깃집에 매력인듯요 같이 구워먹으면 대박이에요,호텔 근처에 있어서 아침메뉴로 먹었는데 맛있어요~ 새우도 생각보다 많이 들어가고 소스도 맛있어요.,"가리비 치즈구이 강추!!
회도 두툼하니 맛있어요
매운탕이나 지리 대신 나오는 들깨 수제비도good",제주 맛집이예요!! 첫날 음식부터 맛있게 먹어서 행복했어요ㅎㅎ 또 갈게용,많은 유명한 제주 흑돼지 맛집중 송훈파크가 1순위,"1. 주문 메뉴: 땅콩만주

지나다니다 사람들이 많이 들어가서 한번 들어가봤네요~
 오~~ 맛집이네요~
겉은 적당히 바삭하고, 속 앙금은 꽉차고 적당히 달콤~
 땅콩도 씹히는 맛도 좋네요~

애월 근처 다니실 분들은 한번 드셔보시길 강추합니다~
 다른분들은 밀크티도 많이들 사가시네요~","고기가 진짜 너무 맛잇어요🤗 고기의 질이 진짜 완전 끝장!!! 
무엇보다 친절하신 사장님과 사모님 덕에 고기의 맛이 더 한거 같아요 ㅎㅎ 감사합니다!! 멀젓이랑 비벼 먹는 밥은 진짜 일품!!😆 무엇보다 김치찌개가 아주그냥 ㅎㅎ 다음에 제주도 오면 또 오려구요 ㅎㅎ
항상 번창하시길 바라겟습니다🤗","명품목살 너무 부드럽고 맛있어요 ! 
짜글이랑 온면이 안된다 하셔서 물냉면 주문했는데 면이 다 뿔어서 실망.... 육수는 맛있었어요 ㅋㅋ 
재방문 완전 가능 !","공간도 멋지고 소품도 이쁘고 ㅠㅠ
무엇보다 디저트랑 커피가 너무 맛있어요 ㅠㅠ
전부터 기대했던 곳인데 !! 
다음부터 제주가면 필수코스로 넣을고에여 ㅠㅠ",제주도에서 예약이 젤 힘든곳이라고 하던데 진짜 맛있네요!!!!! 게딱지에 갈릭라이스 시리얼새우 조합 아직도 생각나요 ㅠ,"제주 놀러와서 갈치조림&구이 맛집 찾아버렸어요ㅎㅎ
가족과 함께 식사하기도 너무 좋네요!
너무너무 맛있게 잘먹고갑니당ㅎ
부모님도 대만족ㅎㅎ!!
직원분도 친절하시고 시설도 쾌적해요! 
갈치포구 포에버❤️‍🔥",빵 종류가 다양하고 커피가 맛있어요!!,NAN,"검색해서 찾아온 곳인데 제주도를 떠나면 생각날 맛이예요!
엄마 시엄마 함께 ㅇㅕ행중 모시구 왔는데
모두 너무너무 맛있어하셨어요! 애월오면 또 찾아오고싶어요😀 서비스와 친절함도 너무 감사합니다~","애월 해안도로에서 만난 뷰맛집 카페.
바다보면서 힐링하기 좋아요!
맛있는 커피는 덤",뷰가 넘 예쁘고 맛도 좋아요! 자주 가고 싶은 가게네요!!,"스노우초밥은 꼭 주문하세요, 존맛탱!
매콤우동은 쏘쏘….😭","요리류도 너무 맛있고
수플레맛집 인정이에요!
다음에 제주와도 또와야지❣️","애월쪽간김에 예전에 핫했던게 기억나서갔는데
음.. 커피맛도 크로아상도 별관?도 애매하고
요즘 워낙 커피맛과 공간감좋은곳이 많아서 
그저그랬던..","탐나는전 사용이 안되서 아쉬웠어요! 
장사가 그만큼 잘되신다는거겠죠? 
금액 생각없이 그래도 맛있게 먹었습니다~"
75,몇년만에 다시 간 리치망고! 넘 맛있어요,제주 여행하면 꼭 들려야 하는 곳이에요 너무 맛있거든요 ><,두부로 코스요리 먹긴 처음이였는데 순두부가 너무 맛있었네요!,일단 친절해서 너무 좋았던거 같습니다. 가게 분위기도 좋고 음식 양도 생각보다 많았던거같아요. 잘 먹고 가요.,맛있어요 :),불판에 흑돼지 고사리 취나물 양파 같이 올려서 먹었어요 윤기가 좔좔 흐르네요 흑돼지는 무조건 여기로 먹으러 와야겠어요🤣,"리뷰 많은걸 보고 가봤는데 너무 맛있었어요 
호텔바로 앞이라 편하고 아침일찍 열어서 너무 좋네요",예약 후 방문한 곳인데 매장도 엄청 넓고 주차할 곳도 넓어서 좋았습니당! 특히 가리비 치즈 구이가 맛있습니다 다들 꼭 시키세요 잘 먹고 갑니다🤍🫶🏻,여기는 흑돼지도 흑돼진데 사이드도 꼭 먹어야함 ㅋㅋ 옛날도시락 기본맛인데도 ㄹㅇ 술안주예요 ㅋㅋㅋㅋ 아예 친구들이랑 각잡고 술마시려고 택시타고 왔다갔다 했어요 ㅋㅋㅋ 다음여행때 또 오기로 했어여 잘부탁드려요,NAN,"매장에 들어가자마자 향이 너무 좋고 직원분이 너무 친절하세요!
아침 일찍 갔는데 주차 공간도 넓어서 편하게 포장해서 다녀옵니다~!","제주도 흑돼지집은 여기가 끝판왕입니다.
너무 맛있습니다@..@ 그리고 황게간장게장도 장난없습니다.. 사장님 부부두분도 너무 친절하시고 밖에 댕댕이도 너무이쁘고 강력추천합니다 한번도 안먹어본사람은 있어도 한번 오면 계속오게되는 제주흑돼지 원탑👍",리뷰 많길래 기대하고 갔는데 전반적으로 별로였음. 직원들 서비스도 안 좋고 공기밥 주문했는데 노룩으로 가져라는듯이 아무말없이 공기밥 쥔 손내밀고 있음. 가게에 msg 안 넣고 신 김치 넣다고 좋게 써놨는데 그낭 여태 먹었던것 중 제일 맛없는 김치찌개였음. 그냥 전반적으로 동네 앞에서 먹는 고기집을 가는게 더 맛있는듯 메리트가 하나도 없음^^,"에끌레어 맛집이래서 방문해봤는데
맛집으로 소문날만 하네요!

너무 맛있어서
지나고 나니 자꾸 생각나는 맛이에요 ㅎㅎ
시그니처 마마롱 에끌레어 완전추천입니다.
다음에 방문하면 여러개 포장해와야겠어요😋😁",취소된 예약 급하게 예약해서 제주에 한달살기 하고있는 언니네부부 가라고 했습니다!! 2년전 폭설때 가보고 못가고 있는데 이렇게 대리만족을 하네요ㅎㅎ 언니네도 쉽게 만족못하는 타입인데 다하나같이 맛잇고 제주에서 한 외식중에 1위라고 칭찬하더라구요❤️ 넘 뿌듯하고 기분좋습니당ㅎㅎ 저도 꼭 다시가고싶어요ㅠㅠ제발,"제주도와서 첫 끼니를 이곳에 다녀왔는데 아주 대만족이예요~
제주도 여행계획 잡았을때부터 눈여겨 보고 저장해뒀던 곳인데 막상가보니 아직 홍보가 덜 됐는지 손님이 없어서 음식 나올때까지 떨렸거든요🥲
근데 왠걸.. 너무 잘 먹고 나왔어요!!
이번 여행은 3대가 다니는 여행이였는데
부모님도 저도 두돌 된 아기도 다 만족한 식사였어요!
코스처럼 메뉴가 나오는데 하나하나 다 맛있어서
저희 부모님이 그릇을 싹싹 비워 드셨답니다ㅋㅋ
사장님들도 친절하셔서 기분좋게 먹고 왔습니다^^
다음에 신랑이랑 아이랑 제주도에 오면
또 들릴 생각이예요~","길가에 예쁘게 자리잡은 웃뜨리

시그니처 음료들과 예쁜 풍경 좋아요~~",청귤밭이 예쁜 카페네요,가족 4명이서 왔는데 돈까스는 양이 생각보다 엄청 많고 겉바속촉 그 자체 먹으면 바사삭 소리 쩔어요. 그리고 파스타 진짜 미친!! 덮밥도 ㄹㅇ 맛도리 무조건 추천!!,바다멍때리기 좋아요,조용하고 아늑한 분위기라 도란도란 얘기하기 좋았어요.,최애에요 대왕연어초밥,"제주 오자마자 들린 카페🫶🏻
넘 예쁘고 넘 맛있는 카페였어요!!!!🤍
제주 오신다면 꼭꼭 들리시길..!!!!",NAN,커리랑 난도 가격대비 맛나요
