39,몇년전 먹었던 망고쥬스! 이번에두 가서 먹었네요^^,여기가 애견동반이 된다고해서 온거라 사실 맛은 기대안했는데 제주에서 먹은 식사중에 가장 만족스러웠어요!,가격대비 쪼금 아쉬웠다.,"저흰 제주도 온 당일에 비행기가 연착이 돼서 지친 몸을 이끌고 근본 고기집에 왔는데 한 입 먹자마자 미쳤다 
10시가 라스트 오더라 9시에 예약을 하고 들어갔는데 직원분들이 너무 친절하게 응대 해주셔서 들어가자마자 기분이 너무 좋았어요 (안경 쓴 알바생분 완전 친절!) 친구랑 둘이서 근본 세트를 먹었는데 비빔 냉면, 짜글이, 멜밥 하나도 빠짐없이 맛있게 웃으면서 먹었습니다 밑반찬도 다 맛있었어요 저흰 특히 명란젓이랑 마요네즈가 고기랑 너무 잘 어울려서 신기했어요 ㅎㅎ 제주도 첫 날부터 행복하게 해주셔서 감사합니다 사장님🤍",너무너무 맛있고 주인아주머니 아저씨도 친절하세요 꼭 방문해보세요 후회없으실꺼예요~!!^^,고기 진짜 부드럽고 육즙이 좌르르 취나물에 꼭 싸드세요ㅠㅠ 또 생각하니까 너무 먹고 싶네요 반찬도 잘나오고 사장님도 친절하세요,맛난 버거입니다. 아이랑 같이 좌식자리에서 먹을 수 있어서 편했습니다 :),"처음 와보는 곳인데 너무 맛았게 잘먹고 갑니다
매장도 이쁘고 직원분들도 친절해요
재방문 의사 많아요~~","말모 고기 
맛나다요 🖤",사진은 없지만 송훈 세프가 운영하는 고기집 정말 맛난거 같아요~ 저희가 갔을땐 송훈 세프님이 다 구워주셔서 너무 맛있게 먹었네요^^ 고기도 직원분들이 다 구워주고 뭐니뭐니해도 고기질이 진짜 짱이였어요~ 밑반찬도 다 맛있고 고기도 맛나고 제주도 갈 일 있음 재방문 하겠습니다~~,"다행히 대기 없이 왔어요!! 
맛잇다고 남편이 엄청 기대해서 왔습니다!! 
만쥬 이쁘고 생각보다 크기 커요!","또 왔습니다.
창원에도 언능 가게 내주세요 🚰·̫🚰",무난하니 좋습니다,"친절하고 서비스 좋아요 또갈것같아요
완맛","예약이 힘들지만 진짜 맛있어요~! 특히 갈릭볶음밥, 칠리크랩, 시리얼새우 요 조합 추천합니당 미고랭도 맛있게 먹었어욤 ㅎㅎㅎ 양도 많고 사장님도 친절하시고 좋습니다 :) 다음에 기회되면 또 방문할게요","부모님이랑 제주맛집 검색해서 왔는데 기대한만큼 맛있었어요.! 사장님 완전 친절하십니다👍👍
메뉴 구성도 알차구 갈치먹으러 왔는데 전복 문어도 왕창 먹었어요..! 최고에여","찾아가기도 쉽고 주차장도 작진 않아서 주차하기 쉽고 공간이 진짜 넓어요
1층은 근데 에어컨 안틀었는데도 시원(?)춥다(?)정도엿고 1층은 따뜻해요 테라스에서 먹고싶었는데 제가간날은 쌀쌀하고 바람 많이불어서 조금 추워서 바로 다시 실내행..ㅋㅌㅌ
빵 진짜 맛있어요 치즈누룽지빵(?) 개쩔
대파 프레첼 개쩔
그 애기 궁댕이같이생긴 하얀 생크림 있는빵도 진짜 부드럽고 맛있었어요!!!
스무디 짱 상콤
아메리카노는 산미가 없어서 그냥 제입맛엔 쏘쏘
시그니처라떼 하르방 라떼는 남녀노소 먹기 좋을거 같아요 다만 하루 30잔 한정이라 오후엔 없을거같아요
저는 다음에 제주도 오면 여기 또올거같아요
빵이 넘모 맛있거든용","크로플도 맛있고 카페 넘 예뻐요
귤 따기도 재밌어요 ㅎㅎ",미친듯이 맛있는 곳은 아니지만 무난하게 맛있어요!!,인절미 크로플이랑 새물에이드 진짜 맛있어요!! 새콤달콤한 상큼 오렌지탄산주스 맛이라서 누구나 좋아할 만한 맛이랍니다💗 인절미 크로플에 아이스크림 올라가있고 떡도 쫄깃해요. 인절미 가루향만 느껴지는게 아니라 달콤한 꿀이랑 그레놀라 맛도 같이 섞여있어서 떡 안좋아하는 사람들도 잘먹을 수 있습니다! 사장님도 친절하시고 새물 전용주차장도 있어서 주차가능합니다. 바로 앞 바다있어서 나가서 사진 찍고 놀았어요 ㅋㅋㅋ,"급하게 예약하고 방문했는데
친절하게 응해주셨고
음식은 아나주 먹었는데
비린내나 잡내 하나도 안나고
너무 맛있게 먹었어요!
성인 남자기준 배도 부르니 양도 넉넉하니 좋아요!!",정말 맛있게 먹었습니다ㅎㅎ 스노우 초밥은 연어초밥위에 치즈 뿌려져있는데 와사비 소스랑 정말 잘 어울렸어요! 가운데에 있는 양파랑 같이 먹으면 덜 느끼하고 무한흡입 가능합니다ㅎㅎ 로제파스타는 소스는 평범했는데 같이 있는 구운 연어토핑이랑도 맛있고 빵 찍어먹으니 맛있었어요ㅎㅎ 연어초밥도 맛있었어요!,"만화나 영화에 나오는 브런치같아요♡
맛도 있고 기분내기 너무 좋았어요! 직원분들 모두 친절하시고 다른 메뉴도 먹어보고 싶어요!","여기 사장님이 보실진 모르겠지만, 영천 능금이들이라며 사진도 찍어주시고, 너무 유쾌하셔서 카페에서 너무 즐거운 시간 보냈습니다! 빨간지붕 이너프 공간은 이제 스튜디오로 사용하신다고 하네요! 실내에서 먹는 건 안될거 같아용 ㅎㅎ 진짜 뷰가 너무 예쁘고 좋은 공간이예요!","사람 많네요 
커리양이 진짜 많아요 
커리두개 치킨 하나 주문하고 싶었는데 양이 많아 쉬림프커리만 시켰어요 
쉬림프커리 매콤해요 안에 알새우가 많이 들어있어요 
탄두리치킨 품절이라 탄두리닭꼬치 시켰는데 넘 뻑뻑하더라구요 
그냥 커리 2개 시키는것도 좋을거같아요"
40,"제주도 여행오면 항상 여기는 무조건 들려서
망고밀크 먹어요ㅜㅜ 진짜 넘 맛있는거같아요
블랙리치망고는 신메뉴라는데 시큼새큼상큼해용",음식도 정갈히 깔끔히 나오고 스끼 진짜 최고에요! 너무 맛있어서 제주 올때마다 옵니다.,깔끔하고 맛있습니다. 가격대가 좀 있네요.,평일 점심쯤 오니까 예약없이 바로 방문해서 웨이팅 없이 음식 빠르게 접할 수 있었어요. 고기 직접 구워주시고 세트 구성이 잘 되어 있습니다 추천추천,너무 맛있었고 친절하셔서 더욱 좋았습니닫,불판에 흑돼지오겹 목살 김치 콩나물무침 양파 등 구워서 먹으니 맛있어요 오겹살 꼬숩고 멜젓이 기가막히네요👍,정말 맛있었습니다 딱새우도 맛있고 고기도요,"횟집같지 않은 외관에 멋스런 인테리어,
가성비 좋은 메뉴와 신선하고 깔끔한 구성에 추천드립니다.",맛잇게먹엇습니다,"사장님귀는 당나귀 송훈쉐프님 고생 고생하셔서 제주도 가면 꼭 가보리라 해서 오늘 왔는데...
실망감이 많이 드네요. 직원교육 많이 시키시던데, 친절 하신분 ?? 쉐프님이 안계셔서 그런가요?? 제주빵집도 딱히 먹을게 없어 소금빵 구입 했는데 겉은 바삭한데... 기름인지 버터인지 많이 묻어 나서...ㅜㅜ
너무 실망스럽습니다. 송훈랜드 너무 멋지네요.
장사가 안되서 안타갑습니다.ㅠㅠ","건물도 너무 아늑하고 매장 너무 깔끔해요 ♥️
제주 오시면 간식으로 꼭 먹어보세요 :) 
포장도 깔끔해서 선물로도 추천드려요 !!!",고기가 맛있어요 육즙도 많고 양념도 적당해서 너무 맛있게 먹었어요 양녕도 너무 진하지않아서 어른부터 아기까지 다 맛있게 먹고갑니다,"제주 도착하자마자 먹으러 왔네요
같이간 친구도 엄지척!
잘먹고 갑니다.","친구 추천으로 처음 왔는데 커피맛도 분위기도 너무 좋네요. 
크리스마스 트리장식은 크리스마스와 연말분위기가 물씬나고 좋았어요. 이미 유명해서 웨이팅은 꽤 했어요. 주차도 쉽지는 않습니다. 참고하세요.","대기해서 예약잡은 보람이있는 집👍🏻
칠리크랩 정말 미쳤구요..💚
거기에 마늘볶음밥 필수입니다
그리고 치킨사태도 필수....
볶음밥에 칠리크랩 살살 비벼먹으면 눈물 좧좔
두번오세요 세번오세요",너무 맛잇어서 허겁지겁 먹다가 급하게 찍은 사진 첨부합니닷 !!!! 너무너무 잘먹구갑니당!!,"제주도에 오면 맛집에 대한 기대가 늘 높아요!
웃뜨리도 제주스러운 메뉴가 가득한 곳이라 설레며 방문했는데
하나하나 다 너무 맛있구 비주얼도 예뻐서 감동했어용 🥹

특히 따뜻한 우유에 담궈서 먹는 미깡 코코아밤은
너무 맛도 좋고 먹는 재미가 있어서 선물로도 추천해요!
(애들이랑 밖에 오두막 포토존 구경하고 사진찍느라
우유가 식었는데 다시 데워주시고 정말 친절하셔요)

층마다 매력이 다른데 운영시간도 다르니 미리 체크하시기 바래요!
제가 갔을 때 기준으로는 1층(귤밭뷰)과 1.5층(세미나룸)은 16시반,
2층(귤밭 & 바다뷰)은 18시까지 영업하고 있었어요 ❣","집 근처라 자주 찾는곳입니다. 
와이도 아이데리고 걸어서 자주가요 ㅎ 
카페 분위기도, 음료나 디져트 맛도 다 좋아요 ㅎ","당근스프 넘 맛나요~돈까스, 파스타도 쵝오입니다👍
편안하게 한끼 잘먹었습니다^^🥰","새물 너무 와보고싶었는데 드디어 왔어요! 오메기크로플 존맛탱구리에다가 새물 커피는 정말 찐입니다. 고소한것이 너무 맛있어요. 특히 새물라떼는 꼭 드셔보세요. 
카페도 너무 깨끗하고 인스타갬성 사진도 찍을수있어요","모든 메뉴가 다 맛있네요
양도 많고, 사장님이 세심히 계속 챙겨주셔서
대접받고온 느낌들었어요
꼬맹이 아들이 계속 제주나기 장어덮밥 얘기를 하네요
꼬맹이도 맛있는건 아나봐요",완전 애정하는 식당이고 늘 한결같이 맛있어요,"지인분 추천받아서 오게 되었는데 너무너무 맛있습니다 🥹🥹 토마토라구뇨끼 소스가 대박이고 완전 쫀듯해요,,,!!! 수플레도 살살 녹습니다 ‼️오믈렛 샌드위치 계란이,, 끝내줘요 👍🏻 정말 모든 메뉴가 다 최고였어요 🩵🩵",흐린날 방문이라 이쁜뷰를 보진 못했는데 맑은날 다시 방문해볼께요 커피도 맛나고 매장도 이뻐요~~고성리 맛집!,"인디언 키친 
매장부터가 너무 아름답습니다
음식은, 직원 말로는 대부분이 맵다고 합니다
그래서 가장 안 매운 치킨 커리 먹었습니다
맛납니다 그리고 난, 치아바타 느낌 났습니다
대망의 양갈비, 향신료 그리 세지 않고요 잡내 없었습니다 다음 날 또 생각나는 양갈비였습니다
언잰가 또 한번 왔으면 하네요"
41,주차 엄청 불편 망고 주스는 맛있어요,매장도 크고 깨끗했어용 ㅎㅎ테이블간에 간격 넓어서 가족끼리 갔는데도 편하게 식사할 수 있었습니다~,단백하고 조미료 하나 없는 건강 그 잡채인 집입니다~ 부모님을 모시고 오고싶네요! 세트가 양이 많아서 배불렀어요!! 두부로 이렇게 많은 요리가 가능하구나 느꼈슴당^^,"제주도 놀러온 커플인데 지나가다가 가게가 깔끔하니 고급스러워서 들어왔는데 고기도 정말 맛있고 특히 냉면이 진짜 맛있어요! 된장찌개도 맛있고 여직원분이 서비스도 좋고 고기도 잘 구워주셔서
잘 먹고 갑니다^^","반신반의로 방문했는데 사장님께서 너무 살갑게 맞아주셔서 기분 좋은 가게네요 🥰
살짝 매콤한 고등어 조림은 살이 부드럽고요,
납작하고 긴 무우는 꼬들한 식감이라 재미도 있었어요!
기분 좋게, 잘 먹고 갑니다!
총평 : 가격 대비 전체적으로 좀 아쉬운 맛",초벌되서 먹음직스럽게 흑돼지 오겹살 나와요 취나물 고사리와 같이 구워서 먹으면 향이 베서 더 맛있고 초벌되서 살짝만 구우면 되네요,"아침일찍부터 가게가 열어서 포장해서 먹었어요! ㅎㅎ
제주시 버거랑 애월읍 버거 하나씩 시켰는데 
저는 딱새우버거가 너무 부드러워서 좋았고
친구는 제주시 버거 소고기 패티가 맛있엇다구 하네요! 
제주시 버거에 들어가는 카라멜라이징된 양파? 가 한군데에 뭉쳐있어서 먹을때 조금 짰어요..! 골고루 넣어주시면 좋을 것 같습니당! ㅎㅎ 맛은 있어용","회를 정말 좋아하는 1인입니다^^
제주에 몇년동안 살았지만
처음으로 맛있는 회를 먹었습니다~
양도많고 신선하고
저희 아이가 최고랍니다^^
담에 또 방문할께요~♡
잘먹었습니다ㅅㅅ",기본으로 주시는 멜젓에 찍어먹거나 고추 들어간 특제소스에 찍어먹으니 고기의 맛이 풍부하게 잘 느껴졌어요. 역시 고기는 파채랑 먹어야 제맛이죠👍🏻,내인생 최고 고기집,"간단한 간식거리 선물하기 위해 애월쪽 검색해보다가 알게된 제주만주 맛도 있고 밤, 우도땅콩, 녹차까지 3가지맛이라 세트로 구입했는데 맛도 있고 선물 받으신분들도 좋아하시네요",토밥즈 보고 찾아온 곳인데 역시나 맛있네요! 흑돼지 양념갈비는 처음인데 촉촉하니 넘나 맛있어요 무조건 추천추천!!,"불빛정원 옆에서 맛있게
저녁 쟐 먹었어요
추천합니다","여긴 평일이어도 사람이 많네요,,ㅠ 오후에 갔더니 디저트 전부 솔드아웃이라 아쉬웠어요
상그리아 마셨는데 독특하니 맛있네요~","최고의 맛입니당
두번째 방문인데 운 좋게 취소표 구해서 일정 다 변경하고 다녀왔어요🥹 
정말 너어무 맛있어요 👍🏻","검색해서 후기 좋은곳으로 찾아왔는데
갈치조림 너무 맛있어요
양념이 밥도둑이라네요 ㅎㅎ",제주 베이커리 맛집 웃뜨리 👍🏻 빈티지 스튜디오 느낌으로 매장이 예뻐서 사진 찍기 너무 좋았고 베이커리랑 음료 다 맛있어서 힐링하고 왔어요 ! 다음에 또 방문 예정입니다 😚,진짜 친절하시고 감귤체험이 넘 맘에들어여,"애월리에에 제주여행 3일차에 저녁식사하러 아이들과 왔어요^^편안한 분위기와 조명, 음악..친절하신 사장님~ 넘 좋아요~ 고양이도 귀엽고, 음식4가지 시켰는데..아이들도 잘먹고~ 탁월한 선택이였어요^^ 아이들과 제주여행오시면 메뉴로 강추해요^^
식전빵도 따듯하고 빠삭하고, 청양고르곤졸피자,, 로제파스타,채끝등심스테이크,돈까스~ 아이들이 좋아하는 메뉴로 맵기조절도 되고~~잘먹었어요^^
다음에 제주여행또오면 방문할게요!♡","애월 오션뷰 노을뷰 맛집이예요
해안도로 바로 앞에 가려지는 건물이 없어서 탁 트이고
애플망고빙수 먹으니 더 맛있게 느껴지네요","식전 차완무시 너무너무 부드러운 푸딩같았고, 히츠마부시는 양념 잘된 장어 가득+곁들임(생강, 와사비, 유자에 절인듯한 무 등)+가쓰오육수 구성이 좋았어요. 다만, 장어에 뼈가 있어서 먹을 때 좀 조심해야했어요. 홀은 넓고, 다인석도 있어서 모임하기 좋을 것 같았습니다. 직원분도 친절하셔서 맛있는 식사 기분좋게 하고 왔어요.","친구가 연어 먹고싶다고 노래를 불러서 애월연어 본점에 다녀왔어요!!! 애월맛집 애월연어본점은 통유리창을 통해 예쁜 정원과 나무를 볼 수 있어서 숲 속에서 식사하는 기분이 나더라구요 직원분들도 넘 친절하고 자리도 넓직하니 너무 쾌적했어요..유명한 스노우초밥 먹었는데 넘 맛났습니다 ㅠㅠ 특제 소스에 폭 찍어 먹으니 어디에서도 맛본적 없는 애월연어에서만 먹을 수 있는 특별한 연어초밥이었어요.. 글 쓰면서 또 먹으러 가고싶네요 츄릅.. 항상 초밥만 먹다가 사시미도 주문해봤는데 진짜 최고였어요! 연어, 연어뱃살, 연어타다끼, 훈제연어 4가지 종류 연어를 취향껏 골라먹을 수 있습니다!! 강추에요
*애월연어에서 제품 및 서비스를 제공받아 솔직하게 작성한 후기입니다.","카페 외관이며 내부 너무 예쁘고 좋아요
사진도 잘나오고 음식도 맛있습니다.
브리오슈와 감자스프 추천해요^^","여기 진짜 저푸른초원위에 그림같은 집을 짓고 노래가 막 떠오르는 곳이에요 ! 
몇년전에 방문했는데 아직 그대로 있어줘서 너무 좋더라구요 ! 여전히 뷰 맛집입니다 ❤️","음식이 양도 많고 전체적으로 깔끔하게 맛있어요!
매장도 넓고 테이블 간격이 넓어서 쾌적하며
정원이 꽃으로 잘 꾸며져 있어서 
기다리면서 구경하기 좋아요!"
42,연월 돈가스 먹고 애플망고 하나 샀는데 넘 맛있어욤,맛도 좋고 뷰도 좋아서 힐링 하고 갈 수 있어요~,두번째 오는 곳입니다 !! 아게다시도후와 모찌리두부는 필수로 드세요... 장어덮밥은 그냥 밥위에 장어였어요 ㅎㅎ 두부먹으러는 두번 세번도 올곳입니다ㅠㅠ👍,"고기 질도 좋고 맛은 그냥 말할 필요도 없이 맛있고요
된장찌개 정말 맛있어서 국물 정말 많이 마셨어요
냉면 맛있구요 냉면집 차리셔야 함..👍🏻","한달만에 다시 찾은 상추밥!
역시 맛도리입니다ㅎㅎ
혼밥도 좋고 여러명 같이오셔도 좋아요!",흑돼지에 멜젓은 필수에요 청양고추 송송 썰어서 멜젓에 넣어주면 느끼함을 잡아주네요 흑돼지 오겹살 직접 고기 구워주셔서 좋아요,"소고기버거에 딱새우패티 추가 
딱새우 토실토실 두께 실화냐..!!!!!! 더맛있네 츄베릅","방어 먹으러 갔는데 방어도 맛있었는데, 돈까스 맛집이네요! 바삭하고 양도 많아요~ 직원분들 다 친절하셔서 기분 좋게 먹고 가요.",웨이팅은 있었지만 고기가 엄청 쫄깃하고 고소하고 맛있어요,"맛있어요! 부모님 모시고 갔는데 부모님도 좋아하세요~ 특히 돈마호크가 맛있네요~
고기 먹고 옆카페가면 딱 좋아요~ 초록초록하고 빵도 맛있어요","엄청 유명한 제주만주!! 아직먹어보진 않았지만 기대되요~~ 너무 맛있을거같아요!!

먹어보고 리뷰 수정해요..!!! 너무너무 맛있어요~~ 유명한 이유가있더라구요.. 진짜 앉은자리에서 남편과함께 순삭..!! 촉촉하고 부드러운 만주에요~~ 나중에 또 올께요!!!","맛집🫶🏻
고기 너무 맛있어요🤤","고기고기 완전 짱 맛있습니다.
친절까지 하니까 제주 올때마다 당골 될 것 같아요~~",오랫만에 ~~ 와본 마마롱 🌰,"누구를 데려가도 다 맛있다며 성공하는 맛집💗
오랜만에 먹고싶어서 한달 전 티켓팅 성공 후 맛보는 호커센터,, 진짜 달마다 오고싶어요🥹✨
다음에도 성공해서 와야지,, 내가 친구가 많았더라면 더 많은 메뉴를 먹었을텐데,, 나중엔 도장깨기로 메뉴 다 먹어보고싶어요!!","순살로 이뤄져있어서 그런지 먹기 너무 편하고, 맛있어요..❤️‍🔥 진짜 오랜만에 갈치조림이 먹고 싶었는데!!! 편하고 맛있게 즐겨서 기분 좋은 점심이였어요
생일이라 미역국 먹고 싶었었는데 매장 내 이벤트 덕분에 미역국도 야무지게 먹을 수 있었어요 감사해용 ♥","매장이 넓어요 각층마다 되어있구 빵도 맛있어요
돌하루방 라떼 처음먹어봤는데 달달 해서 맛있고 우유 부어먹는게 신기방기했어요","포토존많고
귤체험할수있어 서 좋아요",인테리어가 너무 예뻐요 😊 애월리에 파스타랑 뿔소라 아란치니 맛있게 먹었습니다 ~!!,오션뷰 보려고 왔는데 커피도 맛있고 케이크도 맛있어요 ㅎㅎ,인테리어도 깔끔하고 음식도 비주얼굿 맛도 굿입니다 ㅎㅎㅎ 나기세트로 먹으니 코스요리 먹는거같고 좋았어요 ㅎㅎ,연어 정말 좋아하는데 두툼한 연어초밥 스노우치즈&구운연어초밥 두가지 버전으로 원없이 먹고 왔어요 분위기도 너무 좋고 친절하셔서 먹는 내내 행복했습니다 🫶🏻,"우와~진짜 너무 맛있네요. 🤩
감자스프 후추맛 강해서 좋았고요. 아기자기 담아나온 브런치수플레 너무 맛있게 먹었습니다.",뷰가 정말 좋아요,가격이 비싸지만 인도 요리로 특별한 저녁을 보내고 싶을 때 딱이에요. 그리고 맛있어요. 맛있어서 또 가고 싶은 곳.
