16,제주 올때마다 먹네요 아주 예전보단 덜 맛나긴헌데 양도 많이 줄고 가격일 엄청 나게 올랐지만 한번쯤은 먹어볼 맛,여기서 식사하면 아 내가 제주를 왔지 자각하게 되는 곳이에요,"스페셜한 한끼가 먹고 싶어서 찾아간 제주시 신의 한모. 1인 3만원 세트메뉴 주문. 무김치 포함 7가지 메뉴가 코스로 제공된다. 순두부, 수란, 따끈한 두유 한모금, 아게다시도후(짭짤달달한 간장소스를 부어먹는 연두부튀김), 와사비크림새우&두부튀김, 메인 식사메뉴 민물장어덮밥&복지리 (또는 육회덮밥, 콩국수 중 택1 선택 가능). 소량씩 제공되어 비교적 빨리 서빙되고, 메인식사까지 3만원이라니 괜찮네~ 했는데 나중에 메뉴판을 다시 보니 ‘소’자 라서 양은 적다 ㅎㅎ 그래도 두부라는 식재료를 가지고 다양하게 오마카세처럼 코스요리로 만든 점은 방문해볼 만하다. 직원분이 친절하시고 자리가 나름 바다가 보이는 오션뷰라서 좋았음",고기도 초벌 돼서 나오는데 구워주시기까지 해서 너무 편해요!! 가격도 합리적이고 매장도 깔끔하니 넓어서 좋아요😆😆 흑돼지 맛은 말해 모해 희희 잘 먹었습니다. 너무만족했던 식당입니당 제주도 흑돼지는 상호명처럼 근본!!,"찐찐맛집!!❤️언제나 와도 너무 친절하시고 맛있어요!
배불러도 계속 더 먹고 싶은 상추밥이 진짜 미쳤어요!!!
애월오면 꼭 들렸다 가세요👍👍👍
+너무 순하고 귀여운 강아지도 키우셔서 사장님께 말씀드리고 해변가 산책도 함께해요🐶",고기 부들하고 육즙 가득해서 너무 맛있어여 가격도 제주도 생각하면 엄청 괜츈하고 고사리가 확실히 안질리고 너무 맛있네요,"출출해서 엄마랑 온 햄버거집
인테리어가 아기자기하고 재미있게 꾸며져 포토존도 좋구 무엇보다 햄버거 맛있네요
사이즈도 내 주먹보다 커서 튼실~ 👍","숙소가는길에 딱새우 포장하려고 들렸다가
분위기가 너무좋아서 회세트로먹었어요
친절하시고 분위기도 맛도좋아서
기분좋은 야식타임이 되었어요
다음달에 술쟁이친구들이랑 다시오려구요^^",고기양도 많고 맛있어요~ 사이드로 나오는 반찬들도 맛있고.. 옛날도시락👍😋맛있게 너무 잘먹었어요🍺 추천합니다~~~,"송훈파크 크라운돼지 쉐프의선택 A세트 주문해서 먹었습니다~ 고기를 직접 구워주셔서 좋았습니다~ 일반돼지보다 육즙이 더 있는것 같아요 그래서인지 약간 느끼했습니다 저는 볶음밥을 시켰고, 신랑은 냉면을 시켰는데, 신랑이 역쉬 잘 고른것 같아요~ 느끼했는데 볶음밥을 먹으니 더 느끼했습니다 ㅋ 콜라로 느끼함을 달래봤네요~",간단하게 선물하기에 딱 인거 같아서 들렸는데 역시나 선물하기에 너무나 좋네요 !! 버스정류장도 바로 옆에 있어서 위치도 너무 좋습니다,제주도 여행 첫날 바로 찾은 곳인데 명불허전! 진짜 고기 맛이 차원이 다릅니다. 배부른데 초3 아들이 1인븐 더먹겠다고 ㅎㅎ 전 특히 사이드메뉴가 맛있습니다 묻지마 강추 입니다!!,"맛있었어요^^ 
친절도 하고요~","제주도5일잇으면서
3일연속방문한곳입니다 3번모두 테이크아웃 ㅠ 대기줄이 ㅠ 넘나 맛난 커피와 디저트에 뿅반햇어요 가족들 지인들선물로 거하게 사왓네요 진심비싸지만 그만큼 천상의 맛입니다 최고!!!!","남자넷이서 욕심부려서 과하게 시킨게 화근인가.. 배가 터져 첫입의 오묘함을 잊고 많은 양에 스트레스가 ㅜ
예약이 어려워 잔뜩 시킨게 음식의 맛을 저해한듯..
처음 먹어본 음식에 어려워하는 일행도 있었지만 나름 선방한~
남자끼리 재방문은 글쎄?",친구들과 2박3일 제주 여행에 마지막 저녁으로 먹었는데 이번 제주 여행중 제일 맛있었어요🫢🫢 가격 구성 맛 신선함 친절함까지 하나도 빠짐없는 맛집이었습니다!! 다음에 가족이랑 남자친구랑도 꼭 오고싶은 맛집이예요 🫶🏻🫶🏻,"매장도 넓고 깨끗해요~~ 작년에 빵 먹으러 들렸었는데 계속 생각나서 이번에도 들렸어요~~ 음료도 맛있고 빵도 너무 맛있어요~~ 
오는길에 벚나무가 많이 심어져 있어 벚꽃필때 오면 예쁠꺼 같아요~~",서귀포에 안가도 감귤체험을 할수있는 카페라뇨~?!!! 날은 추웠지만... 소박한 5알 들고 와보았담당!! 애플유자티도 상콤하니 맛있아요👍🏻👍🏻,매장도 예쁘고 음식이 진짜 맛있어요!,"제주살이 하고 있을때 종종 갔던 곳인데
뻥 뚫린 테라스에서 멍 때리기 너무 좋습니다 🤤",제주도 놀러온 와중에 숙소 사장님이 적극추천하셔서 방문했어요! 장어가 너무 부드럽고 고소하니 너무 맛있었어요:) 교토에서 먹은 장어덮밥보다 훨씬 맛있었습니다. 그리고 사장님이 너무 친절하세요:) 꼭 사장님이 설명해주신데로 순서대로 드셔보세요!,초뱁먹고싶다해서 점심에 찾아간 애월연어. 오랫만에 방문했더니 메뉴들이 좀 바뀌어 있더라구요. 맛은 여전한듯하구요. 더 좋은것 같아요. 다른 음식들도 궁금합니다.,엄마와 함께 왔는데 너무 맛있게 잘 먹었어요~ 모든 음식 다 만족스럽네요!!ㅎㅎ 레몬 소르베도 상큼👍🏻,"일단 주차하기 편해서 너무 좋았어요.. 그리고 카페 내부도 깔끔하고 분위기가 좋더라구요 테이블도 인스타감성 카페 특유의 낮은테이블 아니라서 더 좋았어요.... 의자도 편해서 오래 앉아서 대화하기 넘 좋더라구요 ㅋㅋㅋ 그리고 별관 빨간지붕 건물이 넘 이뻐서 사진 찍기에도 좋아요!! 날씨 좋을 때 가면 정말 예쁠거 같아요 ㅋㅋㅋ 저는 비오는 날 가서 사진 속에 하늘이 우중충하네요 ㅠㅠ 주차도 편하고 디저트도 맛있었고 자리도 편해서 다음에 날씨 좋을 때 또 방문하려구요!!! 
*이너프에서 제품 및 서비스를 제공받아 솔직하게 작성한 후기입니다.","오랜만에 다시 간 곳인데 확장을 해서 더 멋져졌네요.
마침 해질녘이어서 창밖으로 보이는 하늘색이 너무 예뻤습니다. 
인도 음식을 좋아하는 아이들이 엄지척을 날린 곳!
카레 양과 난의 크기가 '아그라'의 두 배 정도 된다고 생각하고 주문하셔야 해요. 탄두리 치킨, 카레 다 맛있는데 난이 조금만 더 얇았으면 하는 아쉬움이 있습니다. 라씨도 달지 않아서 좋았어요~"
17,"가격이
너무 올라
그게
가장 아쉽고 한라봉 쥬스에선 꼬랑내가 났지만 임 떠나온 직후라 다시
가진 않았습니다 뭐가 원인이었을지요….","가게도 깨끗하고, 횟집 특유 비린내 같은게 안나서 좋았어요, 쾌적해서 맘에드네요.","전에 한번 방문했던 곳이라 
아내랑 다시 방문했어요
바다뷰에 건강한 맛이라 좋았어요",애월에 숙소가 있어서 맛집 검색하다가 찾아서 왔어요. 평일이라서 그런지 웨이팅은 없었고 엄마랑 둘이 근본셋트 먹었는데 고기랑 메뉴들 너무 푸짐하게 나왔네요! 이것저것 먹느라 정신이 없을정도였지만 음식들이 다 깔끔하고 맛있어요! 가성비 최고에여! 엄마가 된장찌개가 너무 시원하고 깔끔하고 맛있다고 꼭 써달라고 하셨어요! 잘먹고갑니다~!,정말 맛있어요! 맵지도 않고 간이 딱 맞았어요 반찬도 너무 맛있습니다! 무조건 재방문할 거에요,"제주에 놀러 왔으니 흑돼지를 먹어야 할 것 같아 리뷰를 보던 중 가장 맛있어 보여 방문 하였습니다^^
저는 잡내가 안나는 것이 가장 중요한데 흑돼지 잡내도 안나고 리뷰들처럼 정말 맛있었습니다~!!매장도 깨끗하고 사장님도 친절 하여 다음에 다시 재방문 하겠습니다!",시간이 좀 지난 뒤 먹었는데도 맛있었어요! 빵이 쫄깃해서 너무 맛있더라구요 그리고 매장이 너~무 예뻐요! 또 가고픈 곳이예요!,"딱새우회랑 고등어 갈치회를 먹고싶었는데 모둠회+딱새우를 시켰는데 모둠회에 고등어회랑 갈치회가 나와서 덕분에 다먹었어요!! 

회가매우신선하고 쫄깃쫄깃 맛있어요 ㅎㅎ

매장도 매우넓고 청결해서 8개월아이랑 갔는데도 너무 편안하게 잘먹다왔어여~~

다음여행에 또오고싶습니다! ✨️",집근처에 있어서 처음방문했는데 고기도 맛있고 양도 많고 좋았어요~^^쫄면도 맛있었어요👍,제주가면 꼭 들리는곳이에요,제주만주 추천해주시는분들이 많아서 들렀는데 사장님도 넘 친절하시고 맛있어요!!콜드블루랑 같이 먹으니까 넘맛있네요🩷9구짜리로 사면 3가지맛 다볼수있어요!!!,"직원이랑 회식하다가 제주도 가자! 하고 제일 처음 목표가 된 집이 여기입니다.
일부로 이 가게 옆의 숙소로 예약하고 왔는데......
아...좀 너무 하다싶은게
사실 저희는 셰프들이거든요?? 근데 사장님 고기 굽는 스킬(직접 구워주심) 보고 1차로 감탄하고 2차로 사장님의 친절한 서비스맨십에 감탄하고 3차로 여기서 먹고 2차로 어디서 술먹어야 되는지 추천해주시는 그 맨즈토킹에 그냥 흑돼지 기름처럼 살살 녹아버렸습니다.. 저 진짜... 진짜진짜 다 걸고 여기 추천드립니다 애월에 계시든 주변 어디 계시든 제주도 오셨고 흑돼지 드실꺼라면 여기로 선택하세요.. 가격이 얼마든 더 드릴 수 있는 식당입니다",흑돼지생고기진짜맛있어요 최고맛집입니다,"시즌마다 다양한 재료로 만든 디져트를 맛볼수 있는 곳이에요! 가을에 마롱글라쎄가 올라간 몽블랑 넘 맛있고요. 고소한 밤크림 가득 밀푀유, 쿠리쿠리 다 맛있어요! 커피도 향도 좋구요- 분위기에 반하고 예쁜 디져트에 또 반하는 곳!",호커센터 너무 좋아요...벌써 예약 7번째네요 1년에 한번씩은 꼬옥 가고싶은 제주 맛집이에요. 나만 아는 맛집이었는데 정말 너무 치열해졌어요~~~ 단 하나의 크랩도 포기 할 수 없어서 3명이가서 세개의 크랩을 주문해 전부 먹었습니다 ㅋㅋㅋㅋㅋ욕심쟁이들의 식사... 진짜 제주도 가면 호커센터 한판 쌔려야합니다 리얼루 ㅜㅜ 이번에도 너무 맛있게 먹었어요 사장님 건강하세요 😭😭😭,다양한 음식을 맛볼 수 있고 순살 갈치 조림이라서 숟가락으로 떠먹기만 하면 되니까 너무 편하고 맛있어요❤️❤️다음에 제주 오면 또 방문하겠습니다🫶,베이커리 맛집답게 케이크 너무 맛있고 다른 베이커리 완전 먹음직스러워 보여요!! 귤 따기 체험두 있고 영화관도 있어서 너무 좋아요💗 음료들도 너무 특색있구 또올집 예약입니다~!!,좋아요 분위기도 좋고 귤체험도 할 수 있어서 좋았어요:),애월에 이런 레스토랑이 있었나요ㅠㅠ 담백하고 자극적이지 않은 신선한 재료의 맛이 넘 좋아요 식당 인테리어 분위기가 아늑하고 예뻐서 사진도 잘나와요 잘먹고갑니다 ❤️,애월 바다를 바로 앞에서 볼 수 있는 오션뷰 카페입니다. 멋진 포토존도 따로 준비되어 있고 음료도 맛있고 분위기도 좋아요. 날씨 안좋을 때에도 풍경이 멋있는 것 같습니다. 덕분에 잘 쉬어갔어요,"갈때마다 항상 친절하시고 음식도 너무 맛있어요👍🏻
특히 장어양이 어마어마하고 새우장,간장게장도 짜지않고
너무 맛있었어요~","두명이서 연어한판 먹었는데 양 무진장 많고 초밥밥도 함께나오니 취향껏 초밥까지 만들어 먹을수 있어서 좋았어요

생연어 훈제연어 숙성연어 연어타다끼 
연어머리구이와 꼬리까지 다양한맛을 느낄수 있으니 좋더라고요. 
좀 비싼가 싶었는데 먹고나니 가격대비 아주 만족스러워요 👍",수플레 먹으러 왔어요~~~~ㅎㅎㅎㅎ 인테리어가 넘 예뻐여,"날씨좋은날 꼭 가세요! 
그리도 말렌카(살구) 엄청 맛있어요! 
강아지동반도되서 좋고, 네컷사진, 아기자기한 소품들도 볼거리가 많아요!","음식은 호불호가 있었지만 그래도 비교적 맛있게 먹었습니다.
정원은 너무나 예쁘게 꾸며져 있고 사진 찍고 산책하기 너무 좋습니다.
단, 1인1메뉴는 좀 불편했습니다.
양이 너무 많은 편이었구요.
음식을 남기면 버려지는것도 마음이 불편,
소식가는 억지로 먹는것도 힘들어요.
양을 좀 줄여서 적게 만들던지
작은 양이 따로 있으면 좋겠습니다."
18,"코코넛 애플망고 너무 맛있어
제주 올 때마다 꼭 찾아가는 매장입니다",가족끼리 가도 너무 좋고 연인이랑 가도 너무 좋아요 추천합니다.,"두부로 요리한 맛있는 식당입니다.
다 먹고 나서 허전함이 가득합니다.
비용에 비해서 양이 너무 적어서 아쉬움이 컸습니다.","들어가자마자 사장님과 직원분들이 친절하게 안내 해주셨습니다! 고기가 잡내 하나 없이 쫄깃하고 너무 맛있습니다! 명란에 마요네즈 섞은 소스가 제 원픽이였어요 ㅎㅎ 근본세트삼겹 시겼는데 같이 나온 김치찌개가 진하고 공깃밥이 땡겼어요! 멜밥?이였나..?? 처음 먹어봤는데 고기랑 같이 먹어도 맛있고 사이드로 나온 젓갈이랑도 너무 잘 어울려요!
물냉면을 후식으로 먹고싶었는데 바로 나와서 좀 당황했는데 육수가 다 살얼음이라서 천천히 고기 먹고 먹어도 시원하고 살얼음이 그대로 있더라고요!! 고기 더 먹으려고 항정살 시켰는데 와 진짜 너무 부드럽고 고소하고 파채나 와사비 올려서 소금 살짝 찍어서 먹으면 너무 맛있더라구요~~! 사장님과 직원분들이 너무 친절하셔서 가게 분위기도 좋았습니다!! 맛있게 배부르게 잘 먹었습니당!",너무너무 맛있었어요~~!!! 다음에 와도 꼭 여기 올거에요 특히 고등어조림이 진짜 너무 맛있었어용~~🤍,흑돼지 오겹살 주문하면 밑반찬이 깔끔하게 나오는데 흑돼지와 먹기 좋고 셀프바에서 반찬 다양하게 준비되어 있어요 흑돼지가 맛있는 고깃집!,"제주시버거 맛있어요~~
번도 쫄깃부드럽고 패티와 치즈 할라피뇨 조합이 맛있어요~속초에서 2시간씩 기다려서 먹었던 버거보다 훨 맛있음~^^","에뉴진체 넘맛있어요ㅜ
방어랑 고듯어회 먹으러왔는데. 둘다 품절이래서 다른거주문했어요
아쉬운데 모듬회주문했는데 다맛있어용ㅎㅎ",삼겹살 맛있게 먹었어요 웨이팅 하고 50분 정도 기다 렸지만 맛있어서 좋았어요 흑돼지 가성비도 좋아요,맛있는 음식점 입니다,"지나가다 보고 맛보고 싶어 회포장하고 문닫기 5분 남기고 다행히 구매. 맛별로 먹어보려고 3가지맛 으로 사봄. 고소하고 맛나요. 만주자체 고물 안좋아하는데, 밤맛,녹차맛이 전 맛나네요. 눈 많이 와서 고립될 때 식량으로 좋으네요.",숙소 바로앞 고기집을왔어요!ㅎㅎ 진짜 맛도최고 친절함도최고! ㅎ 고기도 다 구워주시고 맛있게 먹는 팁까지! 친절해서 너무좋았습니다!ㅎㅎ번창하세요,구워줘서 좋아요 ~~~ 목살 비계가 특이해요,맛없는 디저트 먹는거 세상에서 젤싫어하는 사람인데 여기는 맛별로 다 부시고싶을만큼 싹다 맛있어요.. 거꾸로트리에서 인생샷도 찍고 맛있는 디저트까지먹어서 진짜 행복 그자체♥︎,"미리 주문해서 그런지 음식이 빠르게 나왔어요! 😋
밥이랑 소스 궁합이 최고👍","세트 구성이 너무 좋아요!
순살 갈치조림, 전복물회, 딱새우회, 전복구이 등! 
해산물 조금씩 다 맛보고싶은 분들께 추천드려요!
너무 알찬 구성 완전 제주 한상~!🍊🌊
사장님도 친절하시고 좋습니다 :)","가족여행중에 베이커리가 맛있다고 해서 일부러 찾아왔는데 소문대로 너무 맛있었습니다!
시그니처음료도 너무 맛있었고 뷰도 좋아서 행복한시간 보내고 갑니당!! 
다음번에 또 방문하겠습니당","감귤체험 귤4개까지 무료예용ㅋㅋ
기대햇던거랑 다르게 포토존은 거의 없네요
귤도 포토존에 거의없고 매장안쪽은 예뻐요
감귤체험장 따로잇는곳은 유료예요","비주얼 대박 맛은 더 맛있어서 깜짝놀랐어요
가족들과와도 너무 좋을 거 같아요 추천드립니다
잘 먹었습니다 사장님!","웅장한 파도를 조망 할 수 있고,
맛 나는 치즈케이과 커피가 맛나요~~","맛난 장어정식을 먹었어요.
깔끔하고 분위기 좋은 식당이였습니다.
친절하셨고 사진찍고 쉬기 좋은 정원도 있어요.
저는 동생과 월요일 방문했다가 화요일도 재방문했습니다.
제주 올 때 또 방문할 식당이에요.^^","애월연어 본점은 뭔가 다르네요! 구운연어초밥이 진짜 너어어어무 맛있음
일단 분위기가 넘 좋아서 데이트 하는 느낌 뿜뿜햇구
애월 여행오면 또 올거같아요:)","달달한 브런치~
여행 3일째인데 당보충하고 갑니다. 친절한 안내와 포근한 실내가 좋았어요,
초코라떼가 맛나다고 두 번이나 주문해서 먹은 딸. 음식에 예민해서 걱정 했는데 좋아해 다행이네요. 
맛난 조식 먹고 갑니다.","키워드 선택수가 5개뿐이라 아쉽.
주차공간 넉넉하고 다꾸할 수 있는 소품이 많음.
재방문으로 사장님 친절하시고 직접 잔디 조경 관리하시는 모습이 인상 깊었습니다.
방문할 때마다 관리하고 계시는 모습이셨는데 폭염에도 잔디 물 챙겨주시는 모습에 엄지 척!
덕분에 카페 뷰나 기물들이 깨끗하게 유지가 잘 되나봐요. 강아지가 마당 잔디에 나가자마자 기분 좋아 뒹굴었어요. 토마토바질에이드 최애인데 디저트는 빠른 시간내 품절되니 가급적 빨리 방문하는 게 이득임! 크럼블 맛집",음식도 맛있고 뷰도 끝내주네요 새우커리랑 특히 치즈난은 꼭 한번 드셔보시길 그리고 탄두리치킨은 양도 많고 둘이 먹기는 양이 꽤 많았어요. 꼭 다시 가보고 싶은 곳이예요
19,"솔직히 본점이라는데 생각보다 작다.
그래도 잠깐이지만 쉬기에는 나쁘지 않다.

근데 되도록 픽업을 선택할거 같다",딱새우회 진짜 최애집입니다. 너무 달근하고 푸짐하고 너무 맛있어요,"소문 듣고 찾아간 곳!
특별한 메뉴로 기분전환한 저녁식사였다","고기 정말 맛있고 음식 모두 깔끔했어요.
예약하고 가니 바로 먹을 수 있었습니다.

제주 여행기간 맛있는 저녁 식사가 되었습니다.
아이는 멜밥도 한 그릇 뚝딱 했어요.
친절하신 사장님과 직원분들 덕에 편안한 식사였어요.고기 냉면 찌게 멜밥 모두 추천합니다

기분 좋은 식사였어요
 번창하세요",아늑하니 할머니집 온거같어요 !! 음식들도 너무 맛있고 든든하게 잘 먹고 가요 다음에 제주도 오면 또 오고 싶어요 🗿❤️,고기가 두꺼워저 씹히는 맛이 예술이고 사이드로 냉면도 상쾌하니 맛있어요 애월 맛집 인정이요,"급번개 제주여행에서 첫 식사로 수제 버거 선택했어요. 애월읍(딱새우),제주시(소고기)버거 세트 주문했어요. 컨셉이 독특하고, 크기가 체인점 버거와 확실히 다르고, 따듯하게 바로 나와 좋은 느낌이네요. 감자 맛있어요. 사이드 음료는 얼음 많이 들어간 콜라가 아닌 병콜라라 더 좋았습니다.",생선이 매우 신선하고 맛있습니다. 보기좋게 플레이팅 돼서 나오고 양이 적어보여도 잘 어울리는 밑반찬을 같이 가져다주셔서 만족스러웠습니다.,"고기랑 반찬, 사이드 메뉴 모두 맛있어요! 직원분들도 엄청 친절하십니다😀 엄마랑 할머니가 된장찌개 추천해주신 직원분 너무 친절하게 대해주셔서 감사하다고 전해달라고 해서 리뷰 남겨요. 제주도 오면 꼭 들려야 할 식당입니당💖 고기 또 먹고 싶을 것 같아요 ㅠㅠ",한번은 가보고 싶었는데 좋았어요,제주 디저트 검색하다가 친구 추천으로 왔는데 정말 맛있고 촉촉해용 선물로 딱인거 같아요 !🤍,한점 한점 없어지는게 너무 아까워서 슬펐던 맛집 .. 흑돼지 맛있어요 i luv 광평도새기촌 🥺💗🫶🏻,"예약이 안 되며 자리없으면 밖에서 기다렸다가 호명시 들어갑니다.
식사를 하고 있을 때 몇몇 예약하신 분들이 발길을 돌리시더라구요.
마당같은 공간에 고양이들이 풀어져 있습니다.
식사 후 옆에 있는 불빛정원 티켓이 반값입니다^^","디저트랑 커피가 너무 맛있어요!!
트리도 너무 예쁘고 공간들이 다 예뻐요🎄",너무너무맛있어요 ~ 게살도 발라주시고 서비스좋습니다~또 예약성공하면 좋겠네요~,"귀한 음식을 신선하고 맛있게 먹을 수 있습니당
귀한 분들과 오시기 너무 좋아용
친절하시고 음식이 다 신선하고 맛도리에용
갈치가 입에서 살살 녹습니더 진짜",뷰도 너무 좋고. 베이커리도 너무 맛있고. 직원분들 매우 친절하고 ^^ 제주 여행 마지막에 들렸던 웃뜨리. 여행의 완벽한 마무리 였어요!!! 다음엔 감귤체험도 하고 오두막에서 인생샷도 남기고 올꺼예요~ 제주 카페 웃뜨리 적극추천!!! 완전 강추!!!,"처음에는 너무 복잡할까봐 오길 살짝 망설였는데 오길 잘 한 것 같아요. 시간이 많지 않고 피곤해서 감귤체험도 할 겸 카페에서 쉴 겸 왔는데, 좋은 선택이었어요. 선선한 날씨에 기분 좋은 음악이 흐르는 야외에서 신선한 감귤쥬스로 충전했습니다!",제주에서 파스타는 처음 먹어보는데 애월리에는 아주 좋은 선택이었던 것 같아요!🖤 아란치니가 시그니처메뉴라서 꼭 먹고 싶었는데 왜 시그니처인지 알 수 있었어요…너무 맛있습니다!!!! 식기전에 드세요!!!!!!!!ㅠㅠ스테이크도 맛있었어요 굽기정도나 간이 너무 좋습니다 완전추천해용 예약없이 들어온 곳인데 완벽한 저녁이었습니다~~~🫶🏻,"애월해안도로앞에있어서 뷰가 엄청 좋아요~
예쁜포토존도있고
통창으로 바다보고있으면 시간가는줄 몰라요~
옥상에 야외테라스도 너무 멋져요 ㅎ
커피도맛있고 오메기크러플도 맛있어요~😄","맛은 말할것도 없구 인테리어 넘예쁘고 사장님 친절하셔서 기분좋은 식사였어요^^
밥도 먹었지만 즐거운 추억 하나 또 만들고 가네요`!","이미 도민맛집으로 소문난 애월연어에 가보니 신선한연어를 맛있게 먹을 수 있어서 좋고 매장도 깔끔 좌석도 각각 다 분리되어 어무 좋았어요 
주차도 편리하고 양도 푸짐하고 또 방문할거에요!!
스노우초밥이라 구운연어초밥 토마토우동까지. 다 맛있어여","분위기도 좋고 맛있어요~ 
감자스프 찐 맛있고 수플레팬케이크도 달지 않아서 좋어요! 모양까지 귀엽~
사람 없는 시간에 와서 조용히 즐거운 시간 보냈습니당💙

제주도 오시면 다들 한번 씩 오시면 좋을것 같아요:-)

사장님도 친절하시고 조아요!!","그 유명한 빨간 지붕집이 있는 카페! 주차가능하고요! 뚜벅이족도 방문가능하지만, 정류장에 내려서 오르막길로 10분 정도 걸어가셔야 합니다! 제가 미리 조사했을 때는 별관출입가능하고, '큐브파운드'도 판매하는 걸로 알고있는데, 2023년 7월 기준으로 별관엔 못 들어가고 '큐브파운드'는 판매 안하니 참고하세요! 이곳의 시그니처 메뉴인 '모어댄라떼'마셔봤는데, 맛있고요! 디저트도 판매합니다! 매장이 넓고 깔끔했으며, 통유리를 통해 애월읍의 초록빛풍경, 파란 하늘, 바다까지 한번에 감상할 수 있어서 좋았고, 가끔 비행기가 이륙하거나 착륙하는 모습도 관찰하실 수 있습니다! 그리고 카페 안에 귀여운 굿즈도 판매하고 있어서 구경하는 재미도 있고요! 카페 밖은 포토존이 잘 꾸며져있어서 사진찍는 재미가 있네요!좋았어요☺️",맛있어요~~ 아이들데리고 또 와야겠어요^^
